wav_filename,text
/home/beomgon/DeepSpeech/data/Zeroth/clips/194_003_0710.wav,ㅅㅣㅂ S ㅇㅠㄱ S ㅇㅟ ㅇㅝㄴ ㅈㅏ ㅈㅐ S ㅇㅕㄴ ㅁㅏ S ㄱㅏ ㄱㅗㅇ ㅅㅏ S ㅇㅝㄴ ㄹㅛ ㅁㅜㄹ ㅈㅣㄹ ㅇㅡㄹ S ㄱㅏㄹ ㄱㅗ S ㅇㅠㄴ ㄴㅐ ㄴㅡㄴ S ㅇㅓㅂ ㅁㅜ ㅇㅔ S ㅈㅗㅇ ㅅㅏ ㅎㅏ ㄴㅡㄴ S ㅅㅏ ㄹㅏㅁ ㅇㅣ S ㅈㅏ ㄷㅗㅇ ㅎㅘ ㄷㅚㄹ S ㄱㅏ ㄴㅡㅇ ㅅㅓㅇ ㅇㅡㄴ S ㄱㅜ ㅅㅣㅂ S ㅊㅣㄹ S ㅍㅓ ㅅㅔㄴ ㅌㅡ ㄷㅏ
/home/beomgon/DeepSpeech/data/Zeroth/clips/194_003_0710.wav,ㅇㅣ S ㅇㅠㄱ S ㅇㅟ ㅇㅝㄴ ㅈㅏ ㅈㅐ S ㅇㅕㄴ ㅁㅏ S ㄱㅏ ㄱㅗㅇ ㅅㅏ S ㅇㅝㄴ ㄹㅛ ㅁㅜㄹ ㅈㅣㄹ ㅇㅡㄹ S ㄱㅏㄹ ㄱㅗ S ㅇㅠㄴ ㄴㅐ ㄴㅡㄴ S ㅇㅓㅂ ㅁㅜ ㅇㅔ S ㅈㅗㅇ ㅅㅏ ㅎㅏ ㄴㅡㄴ S ㅅㅏ ㄹㅏㅁ ㅇㅣ S ㅈㅏ ㄷㅗㅇ ㅇㅏㄴ ㅇㅡㄹ S ㄱㅏ ㄴㅡㅇ ㅅㅓㅇ ㅇㅡㄴ S ㄱㅜ ㅅㅣㅂ S ㅊㅣㄹ S ㅍㅓ ㅅㅔㄴ ㅌㅡ ㄷㅏ
/home/beomgon/DeepSpeech/data/Zeroth/clips/139_003_2399.wav,ㅎㅐ ㄷㅏㅇ S ㅇㅣㄴ ㅅㅏ ㄹㅡㄹ S ㅍㅏ ㅁㅕㄴ ㅎㅏ ㄹㅏ ㄴㅡㄴ S ㅁㅗㄱ ㅅㅗ ㄹㅣ ㄱㅏ S ㅋㅓ ㅈㅣ ㄱㅗ S ㅇㅣㅆ ㅈㅣ ㅁㅏㄴ S ㅈㅓㅇ ㅈㅏㄱ S ㄱㅛ ㅇㅠㄱ ㅂㅜ S ㄴㅐ ㅂㅜ ㄱㅣ ㄹㅠ ㄴㅡㄴ S ㅁㅣ ㅇㅗㄴ ㅈㅓㄱ ㅇㅣ ㅇㅓ ㅅㅓ S ㅈㅣㅇ ㄱㅖ S ㅇㅕ ㅂㅜ ㅇㅘ S ㅅㅜ ㅇㅟ ㄱㅏ S ㅈㅜ ㅁㅗㄱ ㄷㅚㄴ ㄷㅏ
/home/beomgon/DeepSpeech/data/Zeroth/clips/139_003_2399.wav,ㅎㅐ ㄷㅏㅇ S ㅇㅣㄴ ㅅㅏ ㄹㅡㄹ S ㅍㅏ ㅁㅕㄴ ㅎㅏ ㄹㅏ ㄴㅡㄴ S ㅁㅗㄱ ㅅㅗ ㄹㅣ ㄱㅏ S ㅋㅓ ㅈㅣ ㄱㅗ S ㅇㅣㅆ ㅈㅣ ㅁㅏㄴ S ㅈㅓㅇ ㅈㅏㄱ S ㄱㅛ ㅇㅠㄱ ㅂㅜ S ㄴㅐ ㅂㅜ S ㄱㅣ ㅈㅜㄴ ㅇㅕㅇ S ㅁㅣ ㅇㅗㄴ ㅈㅓㄱ ㅇㅣ ㅇㅓ ㅅㅓ S ㅈㅣㅇ ㄱㅖ S ㅇㅕ ㅂㅜ ㅇㅘ S ㅅㅜ ㅇㅟ ㄱㅏ S ㅈㅜ ㅁㅗㄱ ㄷㅚㄴ ㄷㅏ
/home/beomgon/DeepSpeech/data/Zeroth/clips/116_003_2375.wav,ㅇㅣ ㅂㅓㄴ ㅇㅔ S ㄴㅗㄴ ㄹㅏㄴ ㅇㅣ S ㄷㅚㄴ S ㄱㅏ ㅉㅏ S ㅂㅏㅇ ㅎㅘ ㅂㅗㄱ ㅇㅣ ㄹㅏ ㄴㅡㄴ S ㄱㅓㅅ ㄷㅗ S ㄱㅡ S ㅅㅣㄴ ㅎㅕㅇ S ㅂㅏㅇ ㅎㅘ ㅂㅗㄱ ㅇㅣ S ㅂㅗ ㄱㅡㅂ ㄷㅚ ㄴㅡㄴ S ㅇㅘ ㅈㅜㅇ ㅇㅔ S ㅇㅣ ㄹㅓㅎ ㄱㅔ S ㅁㅜㄴ ㅈㅔ ㄱㅏ S ㄷㅚㄴ S ㄱㅓㄹ ㄹㅗ S ㅇㅏㄹ ㄱㅗ S ㅇㅣㅆ ㅅㅡㅂ ㄴㅣ ㄷㅏ
/home/beomgon/DeepSpeech/data/Zeroth/clips/116_003_2375.wav,ㅇㅣ ㅂㅓㄴ ㅇㅔ S ㄴㅗㄴ ㄹㅏㄴ ㅇㅣ S ㄷㅚㄴ S ㄱㅏ ㅉㅏ S ㅂㅏㅇ ㅎㅘ ㅂㅗㄱ ㅇㅣ ㄹㅏ ㄴㅡㄴ S ㄱㅓㅅ ㄷㅗ S ㄱㅡ S ㅅㅣㄴ ㅎㅕㅇ S ㅂㅏㅇ ㅎㅘ ㅂㅗㄱ ㅇㅣ S ㅂㅗ ㄱㅡㅂ ㄷㅚ ㄴㅡㄴ S ㅇㅘ ㅈㅜㅇ ㅇㅔ S ㅇㅣ ㄹㅓㅎ ㄱㅔ S ㅁㅜㄴ ㅈㅔ ㄱㅏ S ㄷㅡㅇ ㅁㅜㄹ ㄹㅗ S ㅇㅏㄹ ㄱㅗ S ㅇㅣㅆ ㅅㅡㅂ ㄴㅣ ㄷㅏ
/home/beomgon/DeepSpeech/data/Zeroth/clips/207_003_0296.wav,ㅅㅏ ㅎㅚ ㄱㅏㄹ ㄷㅡㅇ S ㅇㅘㄴ ㅎㅘ ㅇㅘ S ㄱㅜㄱ ㅁㅣㄴ ㅌㅗㅇ ㅎㅏㅂ ㅇㅡㄹ S ㅇㅟ ㅎㅏㄴ S ㅎㅐ ㅂㅓㅂ ㅇㅡ ㄹㅗ ㄴㅡㄴ S ㅇㅠㄱ ㅅㅣㅂ S ㅇㅣㄹ S ㅉㅓㅁ S ㅍㅏㄹ S ㅍㅓ ㅅㅔㄴ ㅌㅡ ㄱㅏ S ㅈㅓㅇ ㅊㅣ ㅇㅣㄴ S ㄷㅡㅇ S ㅈㅜ ㅁㅣㄴ ㄷㅐ ㅍㅛ ㅈㅏ ㅇㅢ S ㅇㅗㄹ ㅂㅏ ㄹㅡㄴ S ㅅㅓㄴ ㅌㅐㄱ ㅇㅡㄹ S ㅈㅔ ㅅㅣ ㅎㅐㅆ ㄷㅏ
/home/beomgon/DeepSpeech/data/Zeroth/clips/207_003_0296.wav,ㅅㅏ ㅎㅚ ㄱㅏㄹ ㄷㅡㅇ ㅇㅘ S ㅁㅏ ㅇㅘ S ㄱㅜㄱ ㅁㅣㄴ ㅌㅗㅇ ㅎㅏㅂ ㅇㅡㄹ S ㅇㅟ ㅎㅏㄴ S ㅎㅐ ㅂㅓㅂ ㅇㅡ ㄹㅗ ㄴㅡㄴ S ㅇㅠㄱ ㅅㅣㅂ S ㅇㅣㄹ S ㅉㅓㅁ S ㅍㅏㄹ S ㅍㅓ ㅅㅔㄴ ㅌㅡ ㄱㅏ S ㅈㅓㅇ ㅊㅣ ㅇㅣㄴ S ㄷㅡㅇ S ㅈㅜ ㅁㅣㄴ ㄷㅐ ㅍㅛ ㅈㅏ ㅇㅢ S ㅇㅗㄹ ㅂㅏ ㄹㅡㄴ S ㅅㅓㄴ ㅌㅐㄱ ㅇㅡㄹ S ㅈㅔ ㅅㅣ ㅎㅐㅆ ㄷㅏ
/home/beomgon/DeepSpeech/data/Zeroth/clips/189_003_0698.wav,ㅂㅏ ㅇㅣ ㄹㅓ ㅅㅡ ㄴㅡㄴ S ㅅㅜㄱ ㅈㅜ S ㅇㅏㄴ ㅇㅔ ㅅㅓ ㅁㅏㄴ S ㅅㅓ ㅅㅣㄱ ㅎㅏ ㄱㅣ ㅇㅔ S ㅅㅜㄱ ㅈㅜ ㄱㅏ S ㅈㅜㄱ ㅇㅡ ㅁㅕㄴ S ㅂㅏ ㅇㅣ ㄹㅓ ㅅㅡ ㄷㅗ S ㅅㅐㅇ ㅈㅗㄴ ㅎㅏㄹ S ㅅㅜ S ㅇㅓㅄ ㄷㅏ
/home/beomgon/DeepSpeech/data/Zeroth/clips/189_003_0698.wav,ㅂㅏ ㅇㅣ ㄹㅓ ㅅㅡ S ㅅㅜㄱ ㅈㅜ S ㅇㅏㄴ ㅇㅔ ㅅㅓ ㅁㅏㄴ S ㅅㅓ ㅅㅣㄱ ㅎㅏ ㄱㅣ ㅇㅔ S ㅅㅜㄱ ㅈㅜ ㄱㅏ S ㅈㅜㄱ ㅇㅡ ㅁㅕㄴ S ㅂㅏ ㅇㅣ ㄹㅓ ㅅㅡ ㄷㅗ S ㅅㅐㅇ ㅅㅏㄴ ㅎㅏㄹ S ㅅㅜ S ㅇㅓㅄ ㄷㅏ
/home/beomgon/DeepSpeech/data/Zeroth/clips/197_003_0667.wav,ㅇㅗ ㄴㅡㄹ ㄴㅏㄹ ㅇㅢ S ㅊㅓㅇ ㅅㅗ ㄴㅕㄴ S ㅅㅔ ㄷㅐ ㄱㅏ S ㅅㅣㅁ ㄱㅏㄱ ㅎㅏㄴ S ㅁㅜㄴ ㅈㅔ ㄹㅡㄹ S ㄱㅕㄲ ㄱㅗ S ㅇㅣㅆ ㄷㅏ ㄴㅡㄴ S ㄷㅔ ㄴㅡㄴ S ㅇㅢ ㅁㅜㄴ ㅇㅢ S ㅇㅕ ㅈㅣ ㄱㅏ S ㅇㅓㅄ ㅅㅡㅂ ㄴㅣ ㄷㅏ
/home/beomgon/DeepSpeech/data/Zeroth/clips/197_003_0667.wav,ㅇㅣ ㄴㅏㄹ ㅇㅢ S ㅊㅓㅇ ㅅㅗ ㄴㅕㄴ S ㅅㅔ ㄷㅐ ㄱㅏ S ㅅㅣㅁ ㄱㅏㄱ ㅎㅏㄴ S ㅁㅜㄴ ㅈㅔ ㄹㅡㄹ S ㄱㅕㄲ ㄱㅗ S ㅇㅣㅆ ㄷㅏ ㄴㅡㄴ S ㄷㅔ ㄴㅡㄴ S ㅇㅢ ㅁㅜㄴ ㅇㅢ S ㅇㅕ ㅈㅣ ㄱㅏ S ㅇㅓㅄ ㅅㅡㅂ ㄴㅣ ㄷㅏ
/home/beomgon/DeepSpeech/data/Zeroth/clips/152_003_0407.wav,ㅈㅣㅂ ㅈㅜ ㅇㅣㄴ ㅇㅣ S ㅈㅣㄱ ㅈㅓㅂ S ㄱㅗ ㄹㅡㄴ S ㅊㅜ ㅅㅏㅇ S ㅎㅚ ㅎㅘ ㅇㅘ S ㅈㅗ ㅎㅕㅇ S ㅈㅏㄱ ㅍㅜㅁ ㄷㅡㄹ ㄷㅗ S ㄱㅓ ㅅㅣㄹ S ㅂㅕㄱ ㅁㅕㄴ ㄱㅘ S ㅈㅜ ㅂㅕㄴ ㅇㅡㄹ S ㄲㅜ ㅁㅣ ㄱㅗ S ㅇㅣㅆ ㄷㅏ
/home/beomgon/DeepSpeech/data/Zeroth/clips/152_003_0407.wav,ㅇㅣ ㅎㅜ ㅇㅣㄴ ㅇㅣ S ㅈㅣㄱ ㅈㅓㅂ S ㄱㅗ ㄹㅡㄴ S ㅊㅜ ㅅㅏㅇ S ㅎㅚ ㅎㅘ ㅇㅘ S ㅈㅗ ㅎㅕㅇ S ㅈㅏㄱ ㅍㅜㅁ ㄷㅡㄹ ㄷㅗ S ㄱㅓ ㅅㅣㄹ S ㅂㅕㄱ ㅁㅕㄴ ㄱㅘ S ㅈㅜ ㅂㅕㄴ ㅇㅡㄹ S ㄲㅜ ㅁㅣ ㄱㅗ S ㅇㅣㅆ ㄷㅏ
/home/beomgon/DeepSpeech/data/Zeroth/clips/210_003_1614.wav,ㅅㅣㅂ S ㅇㅣㄹ S ㅇㅣ ㅅㅣㅂ S ㅅㅏ S ㅇㅣㄹ S ㅎㅗㅇ ㅋㅗㅇ ㅎㅐㅇ ㅇㅡㄴ S ㅂㅣ ㅎㅐㅇ ㅅㅣ ㄱㅏㄴ ㅇㅣ S ㅇㅘㅇ ㅂㅗㄱ S ㅇㅣㄹ ㄱㅗㅂ S ㅅㅣ ㄱㅏㄴ ㅇㅡ ㄹㅗ S ㅇㅕ ㄴㅡ S ㄷㅏㄴ ㄱㅓ ㄹㅣ ㅂㅗ ㄷㅏ S ㄱㅣㄹ ㅇㅓ S ㅅㅡㅇ ㅁㅜ ㅇㅝㄴ S ㅅㅏ ㅇㅣ ㅇㅔ ㅅㅓ S ㅎㅣㅁ ㄷㅡㄹ ㄷㅏ ㄱㅗ S ㅅㅗ ㅁㅜㄴ ㄴㅏ S ㅇㅣㅆ ㄷㅏ
/home/beomgon/DeepSpeech/data/Zeroth/clips/210_003_1614.wav,ㅅㅣㅂ S ㅇㅣㄹ S ㅇㅣ ㅅㅣㅂ S ㅅㅏ S ㅇㅣㄹ S ㄱㅜㄱ ㅇㅡㄴ S ㅂㅣ ㅎㅐㅇ ㅅㅣ ㄱㅏㄴ ㅇㅣ S ㅇㅘㅇ ㅂㅗㄱ S ㅇㅣㄹ ㄱㅗㅂ S ㅅㅣ ㄱㅏㄴ ㅇㅡ ㄹㅗ S ㅇㅕ ㄴㅡ S ㄷㅏㄴ ㄱㅓ ㄹㅣ ㅂㅗ ㄷㅏ S ㄱㅣㄹ ㅇㅓ S ㅅㅡㅇ ㅁㅜ ㅇㅝㄴ S ㅅㅏ ㅇㅣ ㅇㅔ ㅅㅓ S ㅎㅣㅁ ㄷㅡㄹ ㄷㅏ ㄱㅗ S ㅅㅗ ㅁㅜㄴ ㄴㅏ S ㅇㅣㅆ ㄷㅏ
/home/beomgon/DeepSpeech/data/Zeroth/clips/216_003_2389.wav,ㅇㅣ ㄴㅏㅁ ㅅㅣㄴ S ㅎㅏㄴ ㄱㅜㄱ ㅂㅣ ㅈㅓㅇ ㄱㅠ ㄴㅗ ㄷㅗㅇ ㅅㅔㄴ ㅌㅓ S ㅅㅗ ㅈㅏㅇ ㅇㅡㄴ S ㅇㅚ ㅈㅜ ㅇㅓㅂ ㅊㅔ S ㄴㅗ ㄷㅗㅇ ㅈㅏ S ㅇㅣㅂ ㅈㅏㅇ ㅇㅔ ㅅㅓ ㄴㅡㄴ S ㅇㅕㄹ ㅇㅏㄱ ㅎㅏㄴ S ㅈㅗ ㄱㅓㄴ ㅇㅡㄹ S ㄱㅏㅁ ㄴㅐ ㅎㅏ ㅁㅕ S ㄱㅘㄴ ㅎㅐㅇ ㅊㅓ ㄹㅓㅁ S ㅇㅣㄹ ㅎㅐㅆ ㅇㅡㄹ S ㄱㅏ ㄴㅡㅇ ㅅㅓㅇ ㅇㅣ S ㄴㅗㅍ ㄷㅏ ㄱㅗ S ㅎㅐㅆ ㄷㅏ
/home/beomgon/DeepSpeech/data/Zeroth/clips/216_003_2389.wav,ㅇㅣ ㄴㅏㅁ ㅅㅣㄴ S ㅎㅏㄴ ㄱㅜㄱ ㅂㅣ ㅈㅓㅇ ㄱㅠ ㄴㅗ ㄷㅗㅇ ㅅㅔㄴ ㅌㅓ S ㅅㅗ ㅈㅏㅇ ㅇㅡㄴ S ㅇㅚ ㅈㅜ ㅇㅓㅂ ㅊㅔ S ㄴㅗ ㄷㅗㅇ ㅈㅏ S ㅇㅣㅂ ㅈㅏㅇ ㅇㅔ ㅅㅓ ㄴㅡㄴ S ㅇㅕㄹ ㅇㅏㄱ ㅎㅏㄴ S ㅈㅗ ㄱㅓㄴ ㅇㅡㄹ S ㄱㅏㅁ ㄴㅐ ㅎㅏ ㅁㅕ S ㄱㅘㄴ ㅎㅐㅇ ㅊㅓ ㄹㅓㅁ ㅇㅣ S ㄷㅙㅆ ㅇㅡㄹ S ㄱㅏ ㄴㅡㅇ ㅅㅓㅇ ㅇㅣ S ㄴㅗㅍ ㄷㅏ ㄱㅗ S ㅎㅐㅆ ㄷㅏ
/home/beomgon/DeepSpeech/data/Zeroth/clips/196_003_1094.wav,ㅇㅣ ㄹㅓ ㅎㅏㄴ S ㅈㅗ ㅊㅓ ㄹㅗ S ㅈㅣ ㅈㅜㅇ ㅎㅐ S ㅇㅕㄴ ㅇㅏㄴ S ㄷㅗㅇ ㅅㅣㄱ ㅁㅜㄹ ㅇㅢ S ㅇㅣ S ㄷㅗㄱ ㅌㅡㄱ ㅎㅏㄴ S ㅇㅏㄴ ㅅㅣㄱ ㅊㅓ ㄱㅏ S ㄱㅖ ㅅㅗㄱ S ㅂㅗ ㅈㅗㄴ ㄷㅚ ㄱㅣ ㄹㅡㄹ S ㅂㅏ ㄹㅏㅂ ㄴㅣ ㄷㅏ
/home/beomgon/DeepSpeech/data/Zeroth/clips/196_003_1094.wav,ㅇㅣ ㄹㅓ ㅎㅏㄴ S ㅈㅗ ㅊㅓ ㄹㅗ S ㅈㅣ ㅈㅜㅇ ㅎㅐ S ㅇㅕㄴ ㅇㅏㄴ S ㄷㅗㅇ ㅅㅣㄱ ㅁㅜㄹ ㅇㅢ S ㅇㅣ S ㄷㅗㄱ ㅌㅡㄱ ㄱㅏ S ㄴㅏㅁ ㅅㅣㄱ ㅊㅓ ㄱㅏ S ㄱㅖ ㅅㅗㄱ S ㅂㅗ ㅈㅗㄴ ㄷㅚ ㄱㅣ ㄹㅡㄹ S ㅂㅏ ㄹㅏㅂ ㄴㅣ ㄷㅏ
/home/beomgon/DeepSpeech/data/Zeroth/clips/189_003_2045.wav,ㄷㅓ ㅇㅜㄱ ㅇㅣ S ㄱㅣㅁ ㅈㅓㅇ ㅇㅡㄴ S ㅈㅔ S ㅎㅏㄴ S ㅇㅟ ㅇㅝㄴ ㅈㅏㅇ ㅇㅡㄴ S ㅇㅣ ㄴㅏㄹ S ㄱㅜㄱ ㅈㅓㅇ ㅇㅜㄴ ㅇㅕㅇ ㅇㅡㄹ S ㅂㅗ ㅈㅘ ㅎㅏ ㄴㅡㄴ S ㅇㅠ ㅇㅣㄹ ㅎㅏㄴ S ㅎㅕㄹ ㅇㅠㄱ ㅇㅣㄴ S ㅇㅕ ㄷㅗㅇ ㅅㅐㅇ S ㄱㅣㅁ ㅇㅕ ㅈㅓㅇ S ㄴㅗ ㄷㅗㅇ ㄷㅏㅇ S ㅂㅜ ㅂㅜ ㅈㅏㅇ ㄱㅘ S ㅎㅏㅁ ㄲㅔ S ㅇㅣ ㄱㅗㅅ ㅇㅡㄹ S ㅊㅏㅈ ㅇㅏㅆ ㄷㅏ
/home/beomgon/DeepSpeech/data/Zeroth/clips/189_003_2045.wav,ㄷㅓ ㅇㅜㄱ ㅇㅣ S ㄱㅣㅁ ㅈㅓㅇ ㅇㅡㄴ S ㅈㅔ S ㅎㅏㄴ S ㅇㅟ ㅇㅝㄴ ㅈㅏㅇ ㅇㅡㄴ S ㅇㅣ ㄴㅏㄹ S ㄱㅜㄱ ㅈㅓㅇ ㅇㅜㄴ ㅇㅕㅇ ㅇㅡㄹ S ㅂㅗ ㅈㅘ ㅎㅏ ㄴㅡㄴ S ㅇㅠ ㅇㅣㄹ ㅎㅏㄴ S ㅎㅚ ㅇㅠㄱ ㅇㅣㄴ S ㅇㅕ ㄷㅗㅇ ㅅㅐㅇ S ㄱㅣㅁ ㅇㅕ ㅈㅓㅇ S ㄴㅗ ㄷㅗㅇ ㄷㅏㅇ S ㅂㅜ ㅂㅜ ㅈㅏㅇ ㄱㅘ S ㅈㅔ ㅇㅣ S ㅇㅣ ㄱㅗㅅ ㅇㅡㄹ S ㅊㅏㅈ ㅇㅏㅆ ㄷㅏ
/home/beomgon/DeepSpeech/data/Zeroth/clips/186_003_2290.wav,ㅂㅜ ㅊㅣㄴ ㅇㅡㄴ S ㄴㅜ ㄱㅜㄴ ㄱㅏ S ㄷㅗㅇ ㅎㅐㅇ ㅎㅐ S ㅇㅜ ㄹㅣ S ㄷㅜㄹ ㅁㅏㄴ ㅇㅢ S ㅅㅣ ㄱㅏㄴ ㅇㅡㄹ S ㅎㅓ ㄹㅏㄱ ㅎㅏ ㅈㅣ S ㅇㅏㄶ ㅇㅏㅆ ㄱㅗ S ㅁㅏㄴ ㄴㅏㅁ ㅇㅡㄴ S ㄴㅐㅇ ㄹㅐㅇ ㅎㅐㅆ ㄷㅏ ㅁㅕ S ㅅㅜㄱ ㅅㅗ ㄹㅗ S ㅇㅏㄴ ㄴㅐ ㅎㅏ ㅈㅣ ㄷㅗ S ㅇㅏㄶ ㅇㅏㅆ ㄱㅗ S ㅇㅓ ㅉㅓ ㄷㅏ S ㄷㅏ ㅊㅕㅆ ㄴㅡㄴ ㅈㅣ S ㅈㅓㄴ ㅌㅜ ㅇㅔ S ㅊㅏㅁ ㅇㅕ ㅎㅐㅆ ㄴㅡㄴ ㅈㅣ ㄷㅗ S ㅁㅏㄹ ㅎㅏ ㅈㅣ S ㅇㅏㄶ ㅇㅏㅆ ㄷㅏ ㄱㅗ S ㅈㅓㄴ ㅎㅐㅆ ㄷㅏ
/home/beomgon/DeepSpeech/data/Zeroth/clips/186_003_2290.wav,ㅂㅜ ㅊㅣㄴ ㅇㅡㄴ S ㄴㅜ ㄱㅜㄴ ㄱㅏ S ㄷㅗㅇ ㅎㅐㅇ ㅎㅐ S ㅇㅜ ㄹㅣ S ㄷㅜㄹ ㅁㅏㄴ ㅇㅢ S ㅅㅣ ㄱㅏㄴ ㅇㅡㄹ S ㅎㅓ ㄱㅏ ㅈㅣ S ㅇㅏㄶ ㅇㅏㅆ ㄱㅗ S ㅁㅏㄴ ㄴㅏㅁ ㅇㅡㄴ S ㄴㅐㅇ ㄹㅐㅇ ㅎㅐㅆ ㄷㅏ ㅁㅕ S ㅅㅜㄱ ㅅㅗ ㄹㅗ S ㅇㅏㄴ ㄴㅐ ㅎㅏ ㅈㅣ ㄷㅗ S ㅇㅏㄶ ㅇㅏㅆ ㄱㅗ S ㅇㅓ ㅉㅓ ㄷㅏ S ㄷㅏ ㅊㅕㅆ ㄴㅡㄴ ㅈㅣ S ㅈㅓㄴ ㅌㅜ ㅇㅔ S ㅊㅏㅁ ㅇㅢ ㄴㅡㄴ ㅈㅣ ㄷㅗ S ㅁㅏㄹ ㅎㅏ ㅈㅣ S ㅇㅏㄶ ㅇㅏㅆ ㄷㅏ ㄱㅗ S ㅈㅓㄴ ㅎㅐㅆ ㄷㅏ
/home/beomgon/DeepSpeech/data/Zeroth/clips/119_003_1069.wav,ㅅㅗㄴ ㅅㅏㅇ ㄷㅚㄴ S ㅈㅗ ㅈㅣㄱ ㅇㅡㄹ S ㅈㅔ ㄱㅓ ㅎㅏ ㄱㅗ S ㅎㅘㄴ ㅂㅜ ㄹㅡㄹ S ㅊㅚ ㅅㅗ ㅎㅘ ㅎㅏ ㄹㅕ ㅁㅕㄴ S ㅅㅜㄱ ㄹㅕㄴ ㄷㅚㄴ S ㅇㅢ ㄹㅛ ㅈㅣㄴ ㅇㅣ S ㅍㅣㄹ ㅇㅛ ㅎㅐㅆ ㅈㅣ ㅁㅏㄴ S ㅇㅣ ㄹㅓㄴ S ㅌㅡㄱ ㅅㅜ ㅇㅚ ㅅㅏㅇ S ㅅㅜ ㅅㅜㄹ ㅇㅣ S ㄱㅏ ㄴㅡㅇ ㅎㅏㄴ S ㅅㅜㄱ ㄹㅕㄴ ㅇㅢ ㄴㅡㄴ S ㅎㅏㄴ S ㅁㅕㅇ ㅃㅜㄴ ㅇㅣ ㅇㅓㅆ ㄷㅏ
/home/beomgon/DeepSpeech/data/Zeroth/clips/119_003_1069.wav,ㅈㅣ ㄴㅏㄴ ㅎㅐ S ㅈㅗ ㅈㅣㄱ ㅇㅡㄹ S ㅈㅔ ㄱㅓ ㅎㅏ ㄱㅗ S ㅎㅘㄴ ㅂㅜ ㄹㅡㄹ S ㅊㅚ ㅅㅗ ㅎㅘ ㅎㅏ ㄹㅕ ㅁㅕㄴ S ㅅㅜㄱ ㄹㅕㄴ ㄷㅚㄴ S ㅇㅢ ㄹㅛ ㅈㅣㄴ ㅇㅣ S ㅍㅣㄹ ㅇㅛ ㅎㅐㅆ ㅈㅣ ㅁㅏㄴ S ㅇㅣ ㄹㅓㄴ S ㅌㅡㄱ ㅅㅜ ㅇㅚ ㅅㅏㅇ S ㅅㅜ ㅅㅜㄹ ㅇㅣ S ㄱㅏ ㄴㅡㅇ ㅎㅏㄴ S ㅅㅜㄱ ㄹㅕㄴ ㅇㅢ ㄴㅡㄴ S ㅎㅏㄴ S ㅁㅕㅇ ㅃㅜㄴ ㅇㅣ ㅇㅓㅆ ㄷㅏ
/home/beomgon/DeepSpeech/data/Zeroth/clips/187_003_2275.wav,ㅎㅏㄴ ㄱㅜㄱ ㅈㅓㄴ ㄹㅕㄱ ㅇㅔ S ㅈㅓㄱ ㅈㅏ ㄹㅡㄹ S ㄱㅖ ㅅㅗㄱ S ㄱㅏㅇ ㅇㅛ ㅎㅐ ㅇㅑ S ㅎㅏ ㅁㅡ ㄹㅗ S ㅈㅣ ㅅㅗㄱ S ㄱㅏ ㄴㅡㅇ ㅎㅏ ㅈㅣ S ㅇㅏㄶ ㄷㅏ S ㅈㅜ ㅌㅐㄱ ㅇㅛㅇ S ㄷㅐ ㅅㅣㄴ S ㅅㅏㄴ ㅇㅓㅂ ㅇㅛㅇ S ㅈㅓㄴ ㄱㅣ ㅇㅛ ㄱㅡㅁ ㅇㅔ S ㄱㅘ ㄷㅗ ㅎㅏㄴ S ㅈㅣ ㅇㅝㄴ ㅇㅡㄹ S ㅎㅏ ㄴㅡㄴ S ㄱㅓㅅ ㅇㅡㄴ S ㅇㅏ ㄴㅣㄴ ㄱㅏ
/home/beomgon/DeepSpeech/data/Zeroth/clips/187_003_2275.wav,ㅎㅏㄴ ㄱㅜㄱ ㅈㅓㄴ ㄹㅕㄱ ㅇㅔ S ㅈㅓㄱ ㅈㅏ ㄹㅡㄹ S ㄱㅖ ㅅㅗㄱ S ㄱㅏㅇ ㅇㅛ ㅎㅐ ㅇㅑ ㅁㅡ ㄹㅗ S ㅈㅣ ㅅㅗㄱ S ㄱㅏ ㄴㅡㅇ ㅎㅏ ㅈㅣ S ㅇㅏㄶ ㄷㅏ S ㅈㅜ ㅌㅐㄱ ㅇㅛㅇ S ㄷㅐ ㅅㅣㄴ S ㅅㅏㄴ ㅇㅓㅂ ㅇㅛㅇ S ㅈㅓㄴ ㄱㅣ ㅇㅛ ㄱㅡㅁ ㅇㅔ S ㄱㅘ ㄷㅗ ㅎㅏㄴ S ㅈㅣ ㅇㅝㄴ ㅇㅡㄹ S ㅎㅏ ㄴㅡㄴ S ㄱㅓㅅ ㅇㅡㄴ S ㅇㅏ ㄴㅣㄴ ㄱㅏ ㄹㅏ
/home/beomgon/DeepSpeech/data/Zeroth/clips/211_003_1912.wav,ㅅㅓ ㅇㅜㄹ ㅅㅣ ㄴㅏ ㄹㅏ ㅇㅢ S ㅈㅓ ㅊㅜㄹ ㅅㅏㄴ ㅇㅣ S ㅅㅣㅁ ㄱㅏㄱ ㅎㅏ ㄴㅣ S ㅇㅕ ㅅㅓㅇ ㅇㅡㄴ S ㅊㅜㄹ ㅅㅏㄴ ㅇㅡㄹ S ㅎㅐ ㅇㅑ S ㅎㅏ ㄴㅡㄴ S ㅇㅢ ㅁㅜ ㄹㅡㄹ S ㄱㅏ ㅈㅣㄴ S ㄱㅣ ㄱㅖ ㅇㅣㄹ S ㅃㅜㄴ ㅇㅣ ㄷㅏ
/home/beomgon/DeepSpeech/data/Zeroth/clips/211_003_1912.wav,ㅅㅓ ㅇㅜㄹ ㅅㅣ ㄴㅏ ㄹㅏ ㅇㅢ S ㅈㅓ ㅊㅜㄹ ㅅㅏㄴ ㅇㅣ S ㅅㅣㅁ ㄱㅏㄱ ㅎㅏ ㄴㅣ S ㅇㅕ ㅅㅓㅇ ㅇㅡㄴ S ㅊㅜㄹ ㅅㅏㄴ ㅇㅡㄹ S ㅎㅐ ㅇㅑ S ㅎㅏ ㄴㅡㄴ S ㅇㅢ ㅁㅜ ㄹㅡㄹ S ㄱㅏ ㅈㅣㄴ S ㄱㅣ ㄱㅣ S ㅃㅜㄴ ㅇㅣ ㄷㅏ
/home/beomgon/DeepSpeech/data/Zeroth/clips/205_003_2272.wav,ㅇㅏ ㄴㅐ ㄱㅏ S ㄱㅡ ㄹㅓㅎ ㄱㅔ S ㅎㅏ ㄱㅣ ㄹㅗ S ㅎㅏㄴ S ㄱㅓㅅ ㅇㅔ S ㄷㅐ ㅎㅐ S ㄴㅐ ㄱㅔ S ㅇㅏㄹ ㄹㅕ S ㅈㅜ ㅇㅓㅆ ㅇㅡㄹ S ㄸㅐ S ㄴㅏ ㄴㅡㄴ S ㅈㅡㄱ ㅅㅣ S ㅂㅏㄴ ㄷㅐ ㅎㅏ ㅇㅕㅆ ㅅㅡㅂ ㄴㅣ ㄷㅏ
/home/beomgon/DeepSpeech/data/Zeroth/clips/205_003_2272.wav,ㅇㅏ ㄴㅐ ㄱㅏ S ㄱㅡ ㄹㅓㅎ ㄱㅔ S ㅎㅏ ㄱㅣ ㄹㅗ S ㅎㅏㄴ S ㄱㅓㅅ ㅇㅔ S ㄷㅐ ㅎㅐ S ㄴㅐ ㄱㅔ S ㅇㅏㄹ ㄹㅕ S ㅈㅜ ㅇㅓㅆ ㅇㅡㄹ S ㄸㅐ S ㄴㅏ ㄴㅡㄴ S ㅈㅡㄱ ㅅㅣ S ㅂㅏㄴ ㄷㅐ S ㅅㅡㅂ ㄴㅣ ㄷㅏ
/home/beomgon/DeepSpeech/data/Zeroth/clips/210_003_2441.wav,ㅅㅣㅂ S ㅇㅣ S ㅇㅣㄹ S ㅇㅗ ㅈㅓㄴ S ㅇㅕ ㄷㅓㄼ S ㅅㅣ ㄲㅔ S ㄷㅐ ㄱㅜ S ㅈㅜㅇ ㄱㅜ S ㄷㅗㅇ ㅅㅏㄴ ㅇㅢ ㄹㅛ ㅇㅝㄴ ㅇㅔ ㅅㅓ S ㅊㅣ ㄹㅛ ㅂㅏㄷ ㄷㅓㄴ S ㅈㅓㄹ ㄷㅗ S ㅍㅣ ㅇㅢ ㅈㅏ S ㅎㅕㄴ ㅁㅗ ㅆㅣ ㄱㅏ S ㅇㅣ S ㅊㅡㅇ S ㅇㅕ ㅈㅏ S ㅎㅘ ㅈㅏㅇ ㅅㅣㄹ S ㅊㅏㅇ ㅁㅜㄴ ㅇㅡㄹ S ㅌㅗㅇ ㅎㅐ S ㄷㅏㄹ ㅇㅏ ㄴㅏㅆ ㄷㅏ
/home/beomgon/DeepSpeech/data/Zeroth/clips/210_003_2441.wav,ㅅㅣㅂ S ㅇㅣ S ㅇㅣㄹ S ㅇㅗ ㅈㅓㄴ S ㅇㅕ ㄷㅓㄼ S ㅅㅣ ㄲㅔ S ㄷㅐ ㄱㅜ S ㅈㅜㅇ ㄱㅜ S ㄷㅗㅇ ㅅㅏㄴ ㅇㅢ ㄹㅛ ㅇㅔ ㅅㅓ S ㅊㅣ ㅇㅓㅂ ㅇㅏㅆ ㄷㅓㄴ S ㅈㅓㄹ ㄷㅗ S ㅍㅣ ㅇㅢ ㅈㅏ S ㅎㅕㄴ ㅁㅗ ㅆㅣ ㄱㅏ S ㅇㅣ S ㅊㅡㅇ S ㅇㅕ ㅈㅏ S ㅎㅘ ㅈㅏㅇ ㅅㅣㄹ S ㅊㅏㅇ ㅁㅜㄴ ㅇㅡㄹ S ㅌㅗㅇ ㅎㅐ S ㄷㅏㄹ ㅇㅏ ㄴㅏㅆ ㄷㅏ
/home/beomgon/DeepSpeech/data/Zeroth/clips/205_003_1130.wav,ㄱㅗ ㄷㅐ ㄹㅗ ㅂㅜ ㅌㅓ S ㅇㅣㄹ ㅂㅗㄴ S ㅅㅏ ㄹㅏㅁ ㄷㅡㄹ ㅇㅡㄴ S ㅅㅏ ㅋㅜ ㄹㅏ S ㅇㅣㄹ ㅂㅗㄴ ㅇㅢ S ㄲㅗㅊ ㅍㅣ ㄴㅡㄴ S ㅂㅓㅈ ㄴㅏ ㅁㅜ S ㅇㅢ S ㅇㅏ ㄹㅡㅁ ㄷㅏ ㅇㅜㅁ ㅇㅡㄹ S ㅊㅏㄴ ㅁㅣ ㅎㅐ S ㅇㅘㅆ ㅅㅡㅂ ㄴㅣ ㄷㅏ
/home/beomgon/DeepSpeech/data/Zeroth/clips/205_003_1130.wav,ㄱㅗ ㄷㅐ ㄹㅗ ㅂㅜ ㅌㅓ S ㅇㅣㄹ ㅂㅗㄴ S ㅅㅏ ㄹㅏㅁ ㄷㅡㄹ ㅇㅡㄴ S ㅅㅏ ㅋㅜ ㄹㅏ S ㅇㅣㄹ ㅂㅗㄴ ㅇㅢ S ㄲㅗㅊ ㅍㅣ ㄴㅡㄴ S ㅂㅓㅈ ㄴㅏ ㅇㅢ S ㅇㅏ ㄹㅡㅁ ㄷㅏ ㅇㅜㅁ ㅇㅡㄹ S ㅊㅏㄴ ㅁㅣ ㅎㅐ S ㅇㅘㅆ ㅅㅡㅂ ㄴㅣ ㄷㅏ
/home/beomgon/DeepSpeech/data/Zeroth/clips/110_003_1412.wav,ㅇㅕㄱ ㄱㅕㅇ ㅇㅔ S ㅊㅓ ㅎㅏㄹ S ㄸㅐ S ㅇㅏ ㄴㅐ ㄱㅏ S ㅂㅗ ㅇㅕ S ㅈㅜ ㄴㅡㄴ S ㅎㅣㅁ ㄱㅘ S ㅈㅓㄱ ㅇㅡㅇ ㄹㅕㄱ ㅇㅔ S ㄴㅏ ㄴㅡㄴ S ㅈㅣ ㄱㅡㅁ ㄷㅗ S ㄱㅖ ㅅㅗㄱ S ㄱㅕㅇ ㅌㅏㄴ ㅎㅏ ㄱㅗ S ㅇㅣㅆ ㅅㅡㅂ ㄴㅣ ㄷㅏ
/home/beomgon/DeepSpeech/data/Zeroth/clips/110_003_1412.wav,ㅇㅕㄱ ㄱㅕㅇ ㅇㅔ S ㅊㅓ ㅎㅏㄹ S ㄸㅐ S ㅇㅏ ㄴㅐ ㄱㅏ S ㅂㅗ ㅇㅕ S ㅈㅜ ㄴㅡㄴ S ㅎㅣㅁ ㄱㅘ S ㅈㅓㄱ ㅇㅡㅇ ㄹㅕㄱ ㅇㅔ S ㄴㅏ ㅇㅕㄱ S ㅈㅣ ㄱㅡㅁ ㄷㅗ S ㅅㅣ ㅅㅗㄱ S ㄱㅕㅇ ㅌㅏㄴ ㅎㅏ ㄱㅗ S ㅇㅣㅆ ㅅㅡㅂ ㄴㅣ ㄷㅏ
/home/beomgon/DeepSpeech/data/Zeroth/clips/199_003_0556.wav,ㅇㅣ S ㅅㅣㅁ ㅈㅣ ㅇㅔ S ㅂㅜㄹ ㅇㅡㄹ S ㅂㅜㅌ ㅇㅣ ㅁㅕㄴ S ㅎㅘ ㅇㅑㄱ ㅇㅣ S ㅍㅗㄱ ㅂㅏㄹ ㅎㅐ S ㄱㅡ S ㅇㅏㅍ ㅇㅔ S ㅇㅣㅆ ㄴㅡㄴ S ㅅㅚ ㄱㅜ ㅅㅡㄹ S ㅊㅗㅇ ㅇㅏㄹ ㅇㅣ S ㅂㅏㄹ ㅅㅏ ㄷㅚ ㄴㅡㄴ S ㅂㅏㅇ ㅅㅣㄱ ㅇㅣ ㄷㅏ
/home/beomgon/DeepSpeech/data/Zeroth/clips/199_003_0556.wav,ㅇㅣ S ㅅㅣㅁ ㅈㅣ ㅇㅔ S ㅂㅜㄹ ㅇㅡㄹ S ㅂㅜㅌ ㅇㅣ ㅁㅕㄴ S ㅎㅘ ㅇㅑㄱ ㅇㅣ S ㅍㅗㄱ ㅂㅏㄹ ㅎㅐ S ㄱㅡ S ㅇㅏㅍ ㅇㅔ S ㅇㅣㅆ ㄴㅡㄴ S ㅅㅚ ㄱㅜ ㅅㅡㄹ S ㅊㅗㅇ ㅇㅏㄹ ㅇㅣ S ㅂㅏㄹ ㅅㅏ ㄷㅚ ㄴㅡㄴ S ㅂㅏㅇ ㅅㅣㄱ ㅇㅣ ㄷㅏ S ㄷㅏ
/home/beomgon/DeepSpeech/data/Zeroth/clips/212_003_2938.wav,ㄱㅔ ㄷㅏ ㄱㅏ S ㅁㅜ ㄹㅛ ㄱㅡㅂ ㅅㅣㄱ ㅇㅡㄹ S ㅈㅣ ㅇㅝㄴ ㅂㅏㄷ ㄴㅡㄴ ㄷㅏ ㄴㅡㄴ S ㅅㅏ ㅅㅣㄹ ㅇㅡㄹ S ㅂㅏㄴ S ㅊㅣㄴ ㄱㅜ ㄷㅡㄹ ㅇㅔ ㄱㅔ S ㄷㅡㄹ ㅋㅣ ㄱㅗ S ㅅㅣㅍ ㅈㅣ S ㅇㅏㄶ ㅇㅡㄴ S ㅁㅏ ㅇㅡㅁ ㄷㅗ S ㅋㅓㅆ ㅅㅡㅂ ㄴㅣ ㄷㅏ
/home/beomgon/DeepSpeech/data/Zeroth/clips/212_003_2938.wav,ㄱㅔ ㄷㅏ ㄱㅏ S ㅁㅜ ㄹㅛ ㄱㅡㅂ ㅅㅣㄱ ㅇㅡㄹ S ㅈㅣ ㅇㅝㄴ ㅂㅏㄷ ㄴㅡㄴ ㄷㅏ ㄴㅡㄴ S ㅅㅏ ㅅㅣㄹ ㅇㅡㄹ S ㅂㅏㄴ S ㅊㅣㄴ ㄱㅜ ㄷㅡㄹ ㅇㅔ ㄱㅔ S ㄷㅡㄹ ㅋㅣ ㄱㅗ S ㅅㅣㅍ ㅈㅣ S ㅇㅏㄶ ㅇㅡㄴ S ㅁㅏ ㅇㅡㅁ ㄷㅗ S ㅋㅓㅆ ㅅㅡㅂ ㄴㅣ ㄷㅏ S ㄷㅏ
/home/beomgon/DeepSpeech/data/Zeroth/clips/127_003_2938.wav,ㄱㅔ ㄷㅏ ㄱㅏ S ㅁㅜ ㄹㅛ ㄱㅡㅂ ㅅㅣㄱ ㅇㅡㄹ S ㅈㅣ ㅇㅝㄴ ㅂㅏㄷ ㄴㅡㄴ ㄷㅏ ㄴㅡㄴ S ㅅㅏ ㅅㅣㄹ ㅇㅡㄹ S ㅂㅏㄴ S ㅊㅣㄴ ㄱㅜ ㄷㅡㄹ ㅇㅔ ㄱㅔ S ㄷㅡㄹ ㅋㅣ ㄱㅗ S ㅅㅣㅍ ㅈㅣ S ㅇㅏㄶ ㅇㅡㄴ S ㅁㅏ ㅇㅡㅁ ㄷㅗ S ㅋㅓㅆ ㅅㅡㅂ ㄴㅣ ㄷㅏ
/home/beomgon/DeepSpeech/data/Zeroth/clips/127_003_2938.wav,ㄱㅔ ㄷㅏ ㄱㅏ S ㅁㅜ ㄹㅛ ㄱㅡㅂ ㅅㅣㄱ ㅇㅡㄹ S ㅈㅣ ㅇㅝㄴ ㅂㅏㄷ ㄴㅡㄴ ㄷㅏ ㄴㅡㄴ S ㅅㅏ ㅅㅣㄹ ㅇㅡㄹ S ㅂㅏㄴ S ㅊㅣㄴ ㄱㅜ ㄷㅡㄹ ㅇㅔ ㄱㅔ S ㄷㅡㄹ ㅋㅣ ㄱㅗ S ㅅㅣㅍ ㅈㅣ S ㅎㅏ ㄴㅡㄴ S ㅁㅏ ㅇㅡㅁ ㄷㅗ S ㅋㅓㅆ ㅅㅡㅂ ㄴㅣ ㄷㅏ
/home/beomgon/DeepSpeech/data/Zeroth/clips/123_003_0643.wav,ㅇㅗ ㄴㅡㄴ S ㅅㅏㅁ ㅅㅣㅂ S ㅇㅣㄹ S ㄱㅜㄱ ㅎㅚ S ㅂㅗㄴ ㅎㅚ ㅇㅢ ㅇㅔ ㅅㅓ S ㄱㅓㄴ ㅂㅗ S ㄱㅐ ㅍㅕㄴ ㅇㅏㄴ ㅇㅡㄹ S ㅎㅘㄱ ㅈㅓㅇ ㅎㅏ ㅁㅕㄴ S ㄷㅏㅇ ㅈㅏㅇ S ㄴㅐ ㄴㅕㄴ S ㅊㅣㄹ S ㅇㅝㄹ ㅂㅜ ㅌㅓ S ㅂㅏ ㄲㅟㄴ S ㅂㅗ ㅎㅓㅁ ㄹㅛ ㄹㅡㄹ S ㄴㅐ ㅇㅑ S ㅎㅏ ㄱㅗ S ㅇㅠ ㅇㅖ S ㄱㅣ ㄱㅏㄴ ㅇㅣ S ㄲㅡㅌ ㄴㅏ ㄴㅡㄴ S ㅇㅣ ㅊㅓㄴ S ㅇㅣ ㅅㅣㅂ S ㅇㅣ S ㄴㅕㄴ ㅂㅜ ㅌㅓ ㄴㅡㄴ S ㄷㅐ ㅍㅗㄱ S ㅂㅕㄴ ㅎㅘ ㄱㅏ S ㅇㅣㅆ ㅇㅡㄹ S ㅇㅖ ㅈㅓㅇ ㅇㅣ ㄷㅏ
/home/beomgon/DeepSpeech/data/Zeroth/clips/123_003_0643.wav,ㅇㅗ ㄴㅡㄴ S ㅅㅏㅁ ㅅㅣㅂ S ㅇㅣㄹ S ㄱㅜㄱ ㅎㅚ S ㅂㅗㄴ ㅎㅚ ㅇㅢ ㅇㅔ ㅅㅓ S ㄱㅓㄴ ㅂㅗ S ㄱㅐ ㅍㅕㄴ ㅇㅏㄴ ㅇㅡㄹ S ㅎㅘㄱ ㅈㅓㅇ ㅎㅏ ㅁㅕㄴ S ㄷㅏㅇ ㅈㅏㅇ S ㄴㅐ ㄴㅕㄴ S ㅊㅣㄹ S ㅇㅝㄹ ㅂㅜ ㅌㅓ S ㅂㅏ ㄲㅟㄴ S ㅂㅗ ㅇㅕ S ㄴㅐ ㅇㅑ S ㅎㅏ ㄱㅗ S ㅇㅠ ㄹㅣ S ㄱㅣ ㄱㅏㄴ ㅇㅣ S ㄲㅡㅌ ㄴㅏ ㄴㅡㄴ S ㅇㅣ ㅊㅓㄴ S ㅇㅣ ㅅㅣㅂ S ㅇㅣ S ㄴㅕㄴ ㅂㅜ ㅌㅓ ㄴㅡㄴ S ㄷㅐ ㅍㅗㄱ S ㅂㅕㄴ ㅎㅘ ㄱㅏ S ㅇㅣㅆ ㅇㅡㄹ S ㅇㅖ ㅈㅓㅇ ㅇㅣ ㄷㅏ
/home/beomgon/DeepSpeech/data/Zeroth/clips/213_003_0237.wav,ㅅㅓㄴ ㄷㅐ ㅇㅣㄴ S ㄱㅡ ㄹㅓㄴ ㄷㅔ S ㄴㅜ ㄱㅜ ㄴㅏ S ㄴㅡ ㄲㅣ ㅅㅣ ㄱㅔㅆ ㅈㅣ ㅁㅏㄴ S ㅈㅣ ㄱㅡㅁ S ㅇㅣ ㅊㅓㄴ S ㅇㅠㄱ S ㄴㅕㄴ S ㅂㅜ ㄷㅗㅇ ㅅㅏㄴ S ㅍㅗㄱ ㄷㅡㅇ ㄱㅣ S ㄸㅐ ㅂㅗ ㄷㅏ S ㅈㅣ ㄱㅡㅁ S ㅎㅗ ㅎㅘㅇ ㅇㅣㄴ ㄱㅏ
/home/beomgon/DeepSpeech/data/Zeroth/clips/213_003_0237.wav,ㅇㅣ ㄷㅐ S ㄱㅡ ㄹㅓㄴ ㄷㅔ S ㄴㅜ ㄱㅜ ㄴㅏ S ㄴㅡ ㄲㅣ ㅅㅣ ㄱㅔㅆ ㅈㅣ ㅁㅏㄴ S ㅈㅣ ㄱㅡㅁ S ㅇㅣ ㅊㅓㄴ S ㅇㅠㄱ S ㄴㅕㄴ S ㅂㅜ ㄷㅗㅇ ㅅㅏㄴ S ㅍㅗㄱ ㄷㅡㅇ ㄱㅣ S ㄸㅐ ㅂㅗ ㄷㅏ S ㅈㅣ ㄱㅡㅁ S ㅎㅗ ㅎㅘㅇ ㅇㅣㄴ ㄱㅏ
/home/beomgon/DeepSpeech/data/Zeroth/clips/208_003_1388.wav,ㅁㅜㄴ ㅈㅐ ㅇㅣㄴ S ㄷㅐ ㅍㅛ ㅇㅢ S ㅊㅚ ㅊㅡㄱ ㄱㅡㄴ ㅇㅣㄴ S ㅊㅚ S ㅂㅗㄴ ㅂㅜ ㅈㅏㅇ ㅇㅡㄴ S ㅈㅜㅇ ㅈㅣㄴ S ㅇㅢ ㅇㅝㄴ ㄷㅡㄹ ㄱㅘ S ㅅㅜ ㄷㅗ ㄱㅝㄴ S ㅇㅢ ㅇㅝㄴ S ㅁㅗ ㅇㅣㅁ S ㅇㅛ ㄱㅜ ㄷㅐ ㄹㅗ S ㅅㅏ ㅅㅣㄹ ㅅㅏㅇ S ㅊㅗㅇ ㅅㅓㄴ S ㅇㅓㅂ ㅁㅜ ㅇㅔ ㅅㅓ S ㅃㅏ ㅈㅣ ㄱㅗ S ㅇㅣ S ㅅㅓㄴ ㅇㅡ ㄹㅗ S ㅎㅜ ㅌㅚ ㅎㅏ ㄱㅔ S ㄷㅙㅆ ㄷㅏ
/home/beomgon/DeepSpeech/data/Zeroth/clips/208_003_1388.wav,ㅁㅜㄴ ㅈㅐ ㅇㅣㄴ S ㄷㅐ ㅍㅛ ㅇㅢ S ㅊㅚ ㅊㅡㄱ ㄱㅡㄴ ㅇㅣㄴ S ㅊㅚ S ㅂㅗㄴ ㅂㅜ ㅈㅏㅇ ㅇㅡㄴ S ㅈㅜㅇ ㅈㅣㄴ S ㅇㅢ ㅇㅝㄴ ㄷㅡㄹ ㄱㅘ S ㅅㅜ ㄷㅗ ㄱㅝㄴ S ㅇㅢ ㅇㅝㄴ S ㅁㅗ ㅇㅣㅁ S ㅇㅛ ㄱㅜ ㄷㅐ ㄹㅗ S ㅅㅏ ㅅㅣㄹ ㅅㅏㅇ S ㅊㅗㅇ ㅅㅓㄴ ㅎㅏㄴ S ㅇㅣㄴ ㅁㅜ ㅇㅔ ㅅㅓ S ㅃㅏ ㅈㅣ ㄱㅗ S ㅇㅣ S ㅅㅓㄴ ㅇㅡ ㄹㅗ S ㅎㅜ ㅎㅏ ㄱㅔ S ㄷㅙㅆ ㄷㅏ
/home/beomgon/DeepSpeech/data/Zeroth/clips/196_003_2367.wav,ㅇㅠㄱ S ㅇㅣㄹ S ㅌㅗㅇ ㄱㅖ ㅊㅓㅇ ㅇㅔ S ㄸㅏ ㄹㅡ ㅁㅕㄴ S ㅇㅣ ㅊㅓㄴ S ㅅㅣㅂ S ㅅㅏ S ㄴㅕㄴ S ㄱㅣ ㅈㅜㄴ S ㅎㅏㄴ ㄱㅜㄱ ㅇㅣㄴ ㅇㅢ S ㅇㅕ ㄱㅏ S ㅅㅣ ㄱㅏㄴ ㅇㅡㄴ S ㅌㅗㅇ ㄱㅖ ㄹㅡㄹ S ㅊㅓ ㅇㅡㅁ S ㄴㅐ ㄱㅣ S ㅅㅣ ㅈㅏㄱ ㅎㅏㄴ S ㅊㅓㄴ S ㄱㅜ ㅂㅐㄱ S ㄱㅜ ㅅㅣㅂ S ㄱㅜ S ㄴㅕㄴ ㅂㅗ ㄷㅏ S ㅇㅗ ㅎㅣ ㄹㅕ S ㅉㅏㄼ ㅇㅏ ㅈㅕㅆ ㄷㅏ
/home/beomgon/DeepSpeech/data/Zeroth/clips/196_003_2367.wav,ㅇㅣ ㅈㅣ S ㅌㅗㅇ ㄱㅖ ㅊㅓㅇ ㅇㅔ S ㄸㅏ ㄹㅡ ㅁㅕㄴ S ㅇㅣ ㅊㅓㄴ S ㅅㅣㅂ S ㅅㅏ S ㄴㅕㄴ S ㄱㅣ ㅈㅜㄴ S ㅎㅏㄴ ㄱㅜㄱ ㅇㅣㄴ ㅇㅢ S ㅇㅕ ㄱㅏ S ㅅㅣ ㄱㅏㄴ ㅇㅡㄴ S ㅌㅗㅇ ㄱㅖ ㄹㅡㄹ S ㅊㅓ ㅇㅡㅁ S ㄴㅐ ㄱㅣ S ㅅㅣ ㅈㅏㄱ ㅎㅏㄴ S ㅊㅓㄴ S ㄱㅜ ㅂㅐㄱ S ㄱㅜ ㅅㅣㅂ S ㄱㅜ S ㄴㅕㄴ ㅂㅗ ㄷㅏ S ㅇㅗ ㅎㅣ ㄹㅕ S ㅉㅏㄼ ㅇㅏ ㅈㅕㅆ ㄷㅏ
/home/beomgon/DeepSpeech/data/Zeroth/clips/119_003_0658.wav,ㄴㅓ S ㄴㅏ S ㅎㅏㄹ S ㄱㅓㅅ S ㅇㅓㅄ ㅇㅣ S ㅇㅓㅂ ㅊㅔ ㄷㅡㄹ ㅁㅏ ㄷㅏ S ㅁㅐ ㅊㅜㄹ S ㅎㅏ ㄹㅏㄱ S ㅍㅗㄱ ㅇㅣ S ㅇㅖ ㅅㅏㅇ ㅂㅗ ㄷㅏ S ㅅㅣㅁ ㄱㅏㄱ ㅎㅏㄴ S ㅅㅜ ㅈㅜㄴ ㅇㅣㄴ S ㄱㅓㅅ ㅇㅡ ㄹㅗ S ㅍㅏ ㅇㅏㄱ ㄷㅚ ㄱㅗ S ㅇㅣㅆ ㄷㅏ
/home/beomgon/DeepSpeech/data/Zeroth/clips/119_003_0658.wav,ㅇㅣ ㄴㅏ S ㅎㅏㄹ S ㄱㅓㅅ S ㅇㅓㅄ ㅇㅣ S ㅇㅓㅂ ㅊㅔ ㄷㅡㄹ ㅁㅏ ㄷㅏ S ㅁㅐ ㅊㅜㄹ S ㅎㅏ ㄹㅏㄱ S ㅍㅗㄱ ㅇㅣ S ㅇㅖ ㅅㅏㅇ ㅂㅗ ㄷㅏ S ㅅㅣㅁ ㄱㅏㄱ ㅎㅏㄴ S ㅅㅜ ㅈㅜㄴ ㅇㅣㄴ S ㄱㅓㅅ ㅇㅡ ㄹㅗ S ㅍㅏ ㅇㅏㄱ ㄷㅚ ㄱㅗ S ㅇㅣㅆ ㄷㅏ
/home/beomgon/DeepSpeech/data/Zeroth/clips/182_003_1090.wav,ㅎㅗㅇ S ㅈㅣ ㅅㅏ ㄴㅡㄴ S ㅈㅣ ㄴㅏㄴ S ㅍㅏㄹ S ㅇㅣㄹ S ㄱㅗ S ㅅㅓㅇ ㅇㅘㄴ ㅈㅗㅇ S ㅈㅓㄴ S ㄱㅕㅇ ㄴㅏㅁ ㄱㅣ ㅇㅓㅂ S ㅎㅚ ㅈㅏㅇ ㅇㅡ ㄹㅗ ㅂㅜ ㅌㅓ S ㅂㅜㄹ ㅂㅓㅂ S ㅈㅓㅇ ㅊㅣ ㅈㅏ ㄱㅡㅁ ㅇㅡㄹ S ㅂㅏㄷ ㅇㅡㄴ S ㅎㅕㅁ ㅇㅢ ㄹㅗ S ㅇㅣㄹ S ㅅㅣㅁ ㅇㅔ ㅅㅓ S ㅅㅣㄹ ㅎㅕㅇ ㅇㅡㄹ S ㅅㅓㄴ ㄱㅗ ㅂㅏㄷ ㅇㅏㅆ ㅈㅣ ㅁㅏㄴ S ㅂㅓㅂ ㅈㅓㅇ S ㄱㅜ ㅅㅗㄱ ㅇㅡㄴ S ㅁㅕㄴ ㅎㅐㅆ ㄷㅏ
/home/beomgon/DeepSpeech/data/Zeroth/clips/182_003_1090.wav,ㅎㅗㅇ S ㅈㅣ ㅅㅏ ㄴㅡㄴ S ㅈㅣ ㄴㅏㄴ S ㅍㅏㄹ S ㅇㅣㄹ S ㄱㅗ S ㅅㅓㅇ ㅇㅘㄴ ㅈㅗㅇ S ㅈㅓㄴ S ㄱㅕㅇ ㄴㅏㅁ ㅇㅕㄱ S ㅎㅚ ㅈㅏㅇ ㅇㅡ ㄹㅗ ㅂㅜ ㅌㅓ S ㅂㅜㄹ ㅂㅓㅂ S ㅈㅓㅇ ㅊㅣ ㅈㅏ ㄱㅡㅁ ㅇㅡㄹ S ㅂㅏㄷ ㅇㅡㄴ S ㅎㅕㅁ ㅇㅢ ㄹㅗ S ㅇㅣㄹ S ㅅㅣㅁ ㅇㅔ ㅅㅓ S ㅅㅣㄹ ㅎㅕㅇ S ㅅㅓㄴ ㄱㅗ ㅂㅏㄷ ㅇㅏㅆ ㅈㅣ ㅁㅏㄴ S ㅂㅓㅂ ㅈㅓㅇ S ㄱㅜ ㅅㅗㄱ ㅇㅡㄴ S ㅁㅕㄴ ㅎㅐㅆ ㄷㅏ
