wav_filename,text
/home/beomgon/DeepSpeech/data/Zeroth/clips/124_003_2138.wav,ㄸㅗ S ㅁㅗ ㅂㅏ ㅇㅣㄹ S ㄱㅕㄹ ㅈㅔ S ㅅㅓ ㅂㅣ ㅅㅡ S ㅅㅏㅁ ㅅㅓㅇ ㅍㅔ ㅇㅣ ㅇㅘ S ㅎㅏㅁ ㄲㅔ S ㄱㅡㅁ ㅇㅠㅇ ㄱㅘ S ㄱㅕㄹ ㅈㅔ S ㄷㅡㅇ S ㅅㅓ ㅂㅣ ㅅㅡ S ㅊㅡㄱ ㅁㅕㄴ ㅇㅔ ㅅㅓ ㄷㅗ S ㅅㅣ ㄴㅓ ㅈㅣ ㄹㅡㄹ S ㄴㅐㄹ S ㅅㅜ S ㅇㅣㅆ ㄱㅔ S ㄷㅚㄴ ㄷㅏ
/home/beomgon/DeepSpeech/data/Zeroth/clips/124_003_2138.wav,ㅇㅣ S ㅁㅗ ㅂㅏ ㅇㅣㄹ S ㄱㅕㄹ ㅈㅔ S ㅅㅓ ㅂㅣ ㅅㅡ S ㅅㅏㅁ ㅅㅓㅇ ㅍㅔ ㅇㅣ ㅇㅘ S ㅎㅏㅁ ㄲㅔ S ㄱㅜㄱ ㅁㅜ ㅇㅛ
/home/beomgon/DeepSpeech/data/Zeroth/clips/127_003_0104.wav,ㄱㅛ ㅁㅏㄴ ㅎㅐ ㅈㅕ ㅅㅓ S ㅇㅣ ㅅㅏㅇ ㅎㅏㄴ S ㅈㅣㅅ ㅇㅡㄹ S ㅈㅓ ㅈㅣㄹ ㄹㅓ ㅇㅛ S ㅇㅜ ㄹㅣ S ㅇㅕㄱ ㅅㅏ ㅈㅓㄱ ㅇㅡ ㄹㅗ S ㅂㅗ ㅁㅕㄴ
/home/beomgon/DeepSpeech/data/Zeroth/clips/127_003_0104.wav,ㅇㅏ ㅁㅏ ㅇㅔ S ㅈㅓ ㅅㅓ S ㅇㅣ ㅅㅏㅇ ㅎㅏㄴ S ㅅㅣㄹ S ㅅㅣㄹ S ㅈㅓㄴ ㅈㅜ ㄹㅗ S ㅇㅜ ㄹㅣ S ㅇㅕㄱ ㅅㅏ ㅈㅓㄱ ㅇㅡㄹ S ㅂㅗ ㅁㅕㄴ S ㅇㅏ
/home/beomgon/DeepSpeech/data/Zeroth/clips/127_003_1215.wav,ㄱㅣㄴ S ㅂㅏㅁ ㅇㅡㄹ S ㄸㅜㅀ ㄱㅗ S ㅂㅜㄺ ㅇㅡㄴ S ㅎㅐ ㄱㅏ S ㄸㅡ ㅁㅕㄴ S ㄱㅣ ㅊㅏ ㅂㅗ ㄷㅏ S ㄴㅏㄹ ㄹㅕㅂ ㅎㅏㄴ S ㅈㅣ ㅎㅏ ㅊㅓㄹ ㅇㅣ S ㅅㅐ ㅂㅕㄱ S ㄷㅏ ㅅㅓㅅ ㅅㅣ S ㅅㅣㅂ ㅅㅏ ㅂㅜㄴ ㅇㅔ S ㄸㅏ ㄸㅏ ㄸㅏ ㄸㅏ S ㄱㅏ ㅂㅕ ㅇㅜㄴ S ㅇㅡㅁ ㅇㅏㄱ ㅇㅡㄹ S ㅇㅜㄹ ㄹㅣ ㅁㅕ S ㅅㅐ ㅂㅕㄱ ㄴㅕㅋ S ㅊㅓㅅ ㅊㅜㄹ ㅂㅏㄹ ㅇㅡㄹ S ㅎㅏㄴ ㄷㅏ
/home/beomgon/DeepSpeech/data/Zeroth/clips/127_003_1215.wav,ㄱㅏ ㅂㅏㅇ ㅇㅡㄹ S ㅈㅜㄹ ㄱㅗ S ㅂㅜ ㅁㅜㄴ ㅇㅢ ㄱㅏ S ㅈㅡㅇ ㅇㅕ S ㄱㅣ ㅊㅏ ㅂㅗ ㄷㅏ S ㄴㅏㄹ ㄹㅕㅂ ㅎㅏㄴ S ㅈㅣ ㅎㅏ S ㅈㅜㅇ ㅇㅣ S ㅅㅐ ㅂㅕㄱ S ㄷㅏ ㅅㅓㅅ S ㅅㅣ S ㅅㅏ ㅅㅣㅂ S ㅅㅏㅁ S ㅁㅜㄴ ㅇㅔ S ㄷㅏ ㄱㅏ S ㄴㅏ ㄱㅏ ㅂㅕ ㅇㅜㄴ ㅁㅏㄴ ㅇㅡ ㄹㅗ S ㅇㅣ ㅁㅕㄴ ㅅㅐㅇ ㅇㅜㄴ S ㅇㅑㄱ ㅅㅗㄱ ㄱㅣㄹ S ㅂㅏ ㄹㅡㄴ S ㄷㅏ
/home/beomgon/DeepSpeech/data/Zeroth/clips/114_003_0918.wav,ㄱㅡ ㅂㅗ ㄷㅏ ㄴㅡㄴ S ㅂㅐ ㄷㅏㄹ ㅇㅢ ㅁㅣㄴ ㅈㅗㄱ S ㄱㅘㅇ ㄱㅗ ㄹㅡㄹ S ㄸㅓ ㅇㅗㄹ ㄹㅣ ㄴㅡㄴ S ㅅㅏ ㄹㅏㅁ ㅇㅣ S ㅁㅏㄶ ㅇㅡㄹ S ㄱㅓㅅ S ㄱㅏㅌ ㄷㅏ
/home/beomgon/DeepSpeech/data/Zeroth/clips/114_003_0918.wav,ㄱㅡ ㅂㅗ ㄷㅏ ㄱㅏ S ㅂㅐ ㅂㅐㄱ ㅇㅔ S ㅂㅐ ㄷㅗㄱ ㅎㅏㄴ ㄱㅗ ㄹㅡㄹ S ㄸㅓ ㅇㅗㄹ ㄹㅣ ㅈㅣ S ㅂㅏ ㄹㅏ ㅇㅣ S ㅃㅏ ㅇㅔ S ㄱㅏ ㅎㅗㄱ ㅎㅏㄴ S ㅈㅏ
/home/beomgon/DeepSpeech/data/Zeroth/clips/152_003_2281.wav,ㄸㅏㅇ ㅋㅗㅇ ㅂㅗ ㅌㅡ S ㅇㅜㄴ ㅇㅕㅇ ㅇㅓㅂ ㅊㅔ ㅇㅘ S ㅁㅗ ㅌㅓ ㅂㅗ ㅌㅡ S ㅇㅜㄴ ㅈㅓㄴ ㅈㅏ ㄴㅡㄴ S ㅇㅜㄴ ㅇㅕㅇ ㅎㅓ ㄱㅏ ㅇㅘ S ㅇㅜㄴ ㅈㅓㄴ ㅁㅕㄴ ㅎㅓ ㄴㅡㄴ S ㄱㅏㅈ ㅊㅜㄴ S ㄱㅓㅅ ㅇㅡ ㄹㅗ S ㅎㅘㄱ ㅇㅣㄴ ㄷㅙㅆ ㄷㅏ
/home/beomgon/DeepSpeech/data/Zeroth/clips/152_003_2281.wav,ㅎㅏㄴ ㄱㅜㄱ S ㄱㅜㄱ ㅌㅗ ㅇㅕㅇ ㅊㅔ ㄱㅏ S ㅂㅜ ㅌㅓ S ㄷㅗ ㅈㅓㄴ ㅇㅡ ㅇㅏㄴ ㅇㅡㄴ S ㅇㅜㄴ ㅇㅕㅇ ㅎㅓ ㄱㅏ S ㅈㅡㅇ ㅇㅕ ㅎㅏ ㄴㅡㄴ S ㄱㅏㅈ ㅊㅜㄴ S ㄱㅓㅅ ㅇㅡ ㄹㅗ S ㅇㅏ ㅇㅣ ㅎㅐㅆ ㄷㅏ
/home/beomgon/DeepSpeech/data/Zeroth/clips/200_003_0804.wav,ㄷㅐ ㄴㅣ ㅇㅓㄹ ㅇㅡㄴ S ㅇㅕ ㅅㅓㅅ S ㅅㅏㄹ S ㄸㅐ S ㅊㅓ ㅇㅡㅁ ㅇㅡ ㄹㅗ S ㅅㅓㅇ ㅅㅓ S ㅇㅕㄴ ㄱㅜ ㄹㅡㄹ S ㅅㅏ ㅎㅚ ㅎㅏ ㅇㅕㅆ ㅅㅡㅂ ㄴㅣ ㄷㅏ
/home/beomgon/DeepSpeech/data/Zeroth/clips/200_003_0804.wav,ㅇㅜ ㄹㅣ ㄴㅡㄴ S ㅇㅕㄱ ㅅㅏ S ㄸㅐ S ㅊㅓㅇ ㅇㅡ ㄹㅗ S ㅅㅓㅇ ㅅㅓ S ㅇㅕㄴ ㄱㅜ ㄹㅡㄹ S ㅅㅏ ㅎㅚ ㅇㅔ S ㅇㅏ ㅅㅣ ㄴㅏ S ㄷㅏ
/home/beomgon/DeepSpeech/data/Zeroth/clips/117_003_2994.wav,ㅁㅐ ㅈㅏㅇ S ㄱㅗㅅ ㄱㅗㅅ ㅇㅔ ㄴㅡㄴ S ㄸㅐㅇ ㅋㅠ S ㅅㅔ ㅇㅣㄹ S ㅇㅣㅂ ㄱㅏㄴ ㅍㅏㄴ ㄱㅘ S ㅇㅕㅇ ㅇㅓㅂ ㅈㅗㅇ ㄹㅛ S ㅇㅏㄴ ㄴㅐ ㅁㅜㄴ ㅇㅣ S ㅅㅔ ㅇㅝ ㅈㅕㅆ ㄷㅏ
/home/beomgon/DeepSpeech/data/Zeroth/clips/117_003_2994.wav,ㅅㅏㅇ ㄷㅏㅇ S ㅂㅜ ㄱㅗ ㅇㅔ ㄴㅡㄴ S ㅅㅔㄴ ㅌㅡ ㅅㅔ ㅇㅔ S ㄱㅓㄴ ㄱㅏㅇ ㄱㅘ S ㅇㅕㅇ ㅈㅗㅇ ㄹㅛ S ㅇㅏㄴ ㄷㅚ ㅁㅕㄴ ㅅㅓ S ㅈㅕㅆ ㄷㅏ
/home/beomgon/DeepSpeech/data/Zeroth/clips/172_003_2622.wav,ㅎㅏㅅ S ㅍㅡㄹ ㄹㅔ ㅇㅣ ㅅㅡ ㄱㅏ S ㄷㅚㄴ S ㄷㅗㅇ ㄴㅔ ㅇㅢ S ㄱㅡ ㄴㅡㄹ S ㅎㅏ ㄹㅜ ㄱㅏ S ㄷㅏ ㄹㅡ ㄱㅔ S ㅅㅐ ㄹㅗ ㅇㅜㄴ S ㄱㅏ ㄱㅔ ㄷㅡㄹ ㅇㅣ S ㅅㅗㄱ ㅅㅗㄱ S ㄷㅡㄹ ㅇㅓ ㅅㅓ ㄴㅡㄴ S ㅁㅏㅇ ㅇㅝㄴ ㄷㅗㅇ
/home/beomgon/DeepSpeech/data/Zeroth/clips/172_003_2622.wav,ㅇㅣ S ㄱㅣ ㅂㅏㄴ ㅇㅔㄴ S ㄷㅗㅇ ㅎㅐ S ㄱㅡ ㄴㅡㄴ S ㅇㅏ ㄹㅜ ㄱㅏ S ㄷㅏ ㄹㅡ ㄱㅔ S ㅅㅐ ㄹㅗ S ㄱㅏ ㄱㅔ ㄷㅡㄹ ㅇㅣ S ㅅㅗㄱ ㅅㅗㄱ S ㄷㅡ ㄹㅓ S ㅅㅓㄴ ㅇㅓㄴ ㅁㅏ ㅇㅝㄴ ㄷㅗ S ㅇㅏ
/home/beomgon/DeepSpeech/data/Zeroth/clips/175_003_2397.wav,ㅍㅗㄱ ㅂㅏㄹ ㄹㅗ S ㅇㅣㄴ ㅎㅏㄴ S ㅇㅕㄴ ㄱㅣ ㄴㅡㄴ S ㄱㅗㅇ ㅎㅏㅇ S ㅂㅏㄲ S ㅈㅜ ㅊㅏ ㅈㅏㅇ ㄲㅏ ㅈㅣ S ㅍㅓ ㅈㅕ ㄴㅏ ㄱㅏㅆ ㄱㅗ S ㅅㅏ ㄹㅏㅁ ㄷㅡㄹ ㅇㅡㄴ S ㄴㅗㄹ ㄹㅏ S ㄸㅟ ㅊㅕ ㄴㅏ ㄱㅏ ㄱㅣ S ㅂㅏ ㅃㅡㅂ ㄴㅣ ㄷㅏ
/home/beomgon/DeepSpeech/data/Zeroth/clips/175_003_2397.wav,ㄱㅐ ㅂㅏㄹ ㅅㅏ S ㅇㅣ S ㄴㅏ ㅇㅕㅇ ㅈㅣ ㄴㅏㄴ S ㄱㅗㅇ ㅎㅏㅇ S ㅂㅏㄱ S ㅈㅜ ㅊㅏ ㅈㅏㅇ ㄲㅏ ㅈㅣ S ㅍㅓ ㅂㅜ ㅍㅓ ㄷㅗ S ㄴㅏ ㄱㅏㅆ ㄱㅗ S ㅅㅏ ㄹㅏㅁ ㅇㅡ ㄹㅗ S ㅁㅜㄹ ㄹㅏ ㄱㅣ S ㅊㅜ ㅎㅏㄹ S ㄱㅏ ㄱㅣ S ㅂㅏ ㄲㅜㄴ ㄴㅣ ㄷㅏ
/home/beomgon/DeepSpeech/data/Zeroth/clips/152_003_0393.wav,ㅂㅜ ㅌㅏㄴ S ㅈㅓㅇ ㅂㅜ ㄴㅡㄴ S ㄱㅕㅇ ㅈㅏㄱ ㅈㅣ S ㄱㅐ ㅂㅏㄹ S ㄷㅡㅇ ㅇㅔ S ㄴㅗ ㄷㅗㅇ ㄹㅕㄱ ㅇㅣ S ㅍㅣㄹ ㅇㅛ ㅎㅐㅆ ㄴㅡㄴ ㄷㅔ S ㄹㅗㅅ ㅅㅏㅁ ㅍㅏ ㄱㅏ S ㄱㅡ S ㅇㅕㄱ ㅎㅏㄹ ㅇㅡㄹ S ㅁㅏㅌ ㅇㅏㅆ ㄷㅏ
/home/beomgon/DeepSpeech/data/Zeroth/clips/152_003_0393.wav,ㅂㅜ ㅌㅏㄴ S ㅈㅓㅇ ㅂㅜ ㄴㅡㄴ S ㄱㅕㅇ ㅈㅏㄱ ㅈㅣ S ㅇㅕ ㄱㅏ S ㄷㅡㅇ ㅇㅔ S ㄷㅗ ㅈㅓㅇ ㅈㅓㄱ ㅇㅣ S ㅍㅣ ㄴㅡㄴ ㄷㅔ S ㅇㅜ ㅅㅓㄴ S ㅍㅏ ㄱㅏ S ㄱㅡ ㄹㅕ ㄱㅏ S ㅇㅛ
/home/beomgon/DeepSpeech/data/Zeroth/clips/208_003_0838.wav,ㅈㅏㅇ ㅎㅏㄱ ㄱㅡㅁ S ㅎㅓㄴ ㅌㅓ ㄷㅡㄹ ㅇㅡㄴ S ㅇㅏ ㄹㅡ ㅂㅏ ㅇㅣ ㅌㅡ ㄴㅏ S ㄱㅘ ㅇㅚ S ㅎㅘㄹ ㄷㅗㅇ ㅂㅗ ㄷㅏ S ㅈㅏㅇ ㅎㅏㄱ ㄱㅡㅁ ㅇㅣ S ㅎㅝㄹ ㅆㅣㄴ S ㄷㅡㄱ ㅇㅣ ㄹㅏ ㄱㅗ S ㅁㅏㄹ ㅎㅏㄴ ㄷㅏ
/home/beomgon/DeepSpeech/data/Zeroth/clips/208_003_0838.wav,ㅇㅏ ㅁㅏ ㄱㅡㄴ S ㅎㅘㄴ ㅈㅏ ㄷㅡㄹ ㅇㅡㄴ S ㅇㅏ ㄹㅡ ㅂㅏ ㅇㅣ ㅌㅡ ㄴㅏ S ㄱㅘ ㅇㅣㄹ ㅈㅜ ㄹㅗ ㄱㅏ S ㅈㅏ ㄱㅡㅁ ㅇㅣ S ㅎㅝㄹ ㅅㅔㄴ ㅌㅡ ㅇㅣ ㄹㅏ ㄱㅗ S ㅎㅘ ㅎㅏㄴ ㄷㅏ
/home/beomgon/DeepSpeech/data/Zeroth/clips/130_003_2815.wav,ㅇㅕ ㅎㅗ ㅇㅘ ㅇㅢ S ㅈㅏ ㅂㅣ ㄱㅏ S ㅇㅓㅄ ㅇㅓㅆ ㄷㅏ ㅁㅕㄴ S ㅈㅣ ㄱㅡㅁ ㅉㅡㅁ S ㄴㅏ ㄴㅡㄴ S ㅇㅓ ㄸㅓㅎ ㄱㅔ S ㄷㅚ ㅇㅓㅆ ㅇㅡㄹ S ㄱㅓㅅ ㅇㅣㅂ ㄴㅣ ㄲㅏ
/home/beomgon/DeepSpeech/data/Zeroth/clips/130_003_2815.wav,ㅇㅕ ㅎㅗ ㅇㅘ ㅇㅢ S ㅈㅏ ㅂㅣ ㄱㅏ S ㅇㅓㅄ ㅇㅓㅆ ㄷㅏ ㄴㅏ ㅈㅣ S ㅁㅗ ㄷㅡㄴ S ㄷㅏㄴ ㅇㅓ ㅇㅓ ㄷㅓ ㅇㅔ S ㄷㅡㄹ ㅇㅓ ㅈㅣㄹ S ㄱㅓㅅ ㅇㅣㅂ ㄴㅣ ㄱㅏ ㄲㅏ
/home/beomgon/DeepSpeech/data/Zeroth/clips/145_003_1168.wav,ㄱㅡ ㄷㅡㄹ ㅇㅡㄴ S ㅍㅡㄹ ㄹㅗ ㄹㅏ ㄱㅏ S ㅈㅏ ㅅㅣㄴ ㄷㅡㄹ ㅇㅢ S ㅅㅜ ㅎㅗ S ㅇㅕ ㅅㅣㄴ ㅇㅣ ㄹㅏ ㄱㅗ S ㅅㅐㅇ ㄱㅏㄱ ㅎㅐㅆ ㄱㅣ S ㄸㅐ ㅁㅜㄴ ㅇㅣㅂ ㄴㅣ ㄷㅏ
/home/beomgon/DeepSpeech/data/Zeroth/clips/145_003_1168.wav,ㅇㅣ ㄷㅡㄹ S ㄱㅡ ㄷㅡㄹ ㅇㅡㄴ S ㅍㅡㄹ ㄹㅗ ㄹㅏ ㄱㅏ S ㅈㅏ ㅅㅣㄴ ㄷㅡㄹ ㅇㅢ S ㅅㅜ S ㅇㅕㄱ ㅅㅣ S ㅇㅕ S ㅅㅏ ㅌㅐ ㄱㅣ S ㄸㅐ ㅁㅜㄴ ㅇㅣㅂ ㄴㅣ ㄷㅏ S ㄷㅏ
/home/beomgon/DeepSpeech/data/Zeroth/clips/117_003_1878.wav,ㅈㅣ ㄱㅡㅁ S ㅇㅑ ㄷㅏㅇ ㅇㅔ S ㄱㅣㅁ ㄷㅐ ㅈㅜㅇ S ㄷㅐ ㅌㅗㅇ ㄹㅕㅇ S ㄴㅗ ㅁㅜ ㅎㅕㄴ S ㄷㅐ ㅌㅗㅇ ㄹㅕㅇ S ㅅㅏ ㅈㅣㄴ S ㅇㅏㄴ S ㄱㅓㄹ ㄹㅕ S ㅇㅣㅆ ㅅㅡㅂ ㄴㅣ ㄲㅏ
/home/beomgon/DeepSpeech/data/Zeroth/clips/117_003_1878.wav,ㅈㅣ ㄱㅡㅁ S ㅇㅑ ㄷㅏㅇ ㅇㅔ S ㄱㅣㅁ ㄷㅐ ㅈㅜㅇ S ㄷㅐ ㅌㅗㅇ ㄹㅕㅇ S ㅂㅜ ㅂㅜㄴ ㅇㅡ ㅁㅕㄴ S ㅅㅏ ㅅㅣㄹ ㅅㅏㅇ S ㄱㅓㄹ ㄹㅕ S ㅇㅣㅆ ㄴㅡㄴ ㄱㅏ S ㄹㅏ
/home/beomgon/DeepSpeech/data/Zeroth/clips/142_003_0609.wav,ㅎㅏㄹ ㅁㅓ ㄴㅣ ㅇㅢ S ㅇㅣ ㅇㅜㅅ ㄷㅡㄹ S ㅈㅜㅇ S ㅅㅏㅇ ㄷㅏㅇ ㅅㅜ ㄱㅏ S ㅋㅗ ㅋㅗ ㄴㅓㅅ S ㅁㅗㄱ ㅈㅐ ㄹㅗ S ㅇㅗ ㄷㅜ ㅁㅏㄱ ㅇㅡㄹ S ㅈㅣ ㅇㅓㅆ ㄱㅗ S ㅈㅣ ㅂㅜㅇ ㅇㅡㄴ S ㅁㅏㄹ ㄹㅣㄴ S ㅋㅗ ㅋㅗ ㄴㅓㅅ S ㅇㅣㅍ ㅇㅡ ㄹㅗ S ㅁㅏㄴ ㄷㅡㄹ ㅇㅓㅆ ㅈㅣ ㅇㅛ
/home/beomgon/DeepSpeech/data/Zeroth/clips/142_003_0609.wav,ㅇㅓ ㅁㅓ ㄴㅣ S ㅇㅠ ㄷㅗ S ㅈㅜㅇ S ㅅㅏㅇ ㄷㅏㅇ ㅅㅜ ㄱㅏ S ㅋㅗ ㅂㅗ ㅎㅗ S ㅈㅔ S ㅇㅗ ㄷㅜ ㄹㅏ ㅇㅡㄹ S ㅈㅣ ㅇㅓㅆ ㄱㅗ S ㅈㅣ ㅂㅜ S ㅁㅏㄴ ㄹㅣㄴ S ㅎㅏ ㄱㅗ S ㄴㅏ ㄴㅣ ㅇㅡ ㄹㅗ S ㅁㅏㄴ ㄷㅡㄹ ㅇㅓㅆ ㅈㅣ ㅇㅛ ㅇㅛ
/home/beomgon/DeepSpeech/data/Zeroth/clips/114_003_0887.wav,ㅎㅏ ㅁㅏ ㄴㅡㄴ S ㄸㅏㅇ S ㅇㅟ ㅇㅔ ㅅㅓ S ㅎㅗㄴ ㅈㅏ S ㅍㅜㄹ ㅇㅡㄹ S ㅁㅓㄱ ㄱㅗ S ㅇㅣㅆ ㅇㅡㄹ S ㄱㅕㅇ ㅇㅜ S ㅅㅏ ㅈㅏ ㄷㅡㄹ ㅇㅢ S ㄱㅗㅇ ㄱㅕㄱ ㅇㅡㄹ S ㅂㅏㄷ ㄱㅣ S ㅅㅟㅂ ㅅㅡㅂ ㄴㅣ ㄷㅏ
/home/beomgon/DeepSpeech/data/Zeroth/clips/114_003_0887.wav,ㅎㅏ ㅁㅏ ㄴㅡㄴ S ㄸㅏㅇ ㅇㅣ ㅅㅓㅇ ㅇㅡㄴ S ㅈㅏㄱ ㅍㅜㅁ ㅇㅡㄹ S ㅂㅗ ㄱㅗ S ㅇㅣㅆ ㅇㅡㄹ S ㄱㅕㅇ ㅇㅜ S ㅅㅏ ㅈㅏ ㄷㅡㄹ ㅇㅢ S ㄱㅗㅇ ㄱㅕㄱ ㅇㅡㄹ S ㅂㅏㄷ ㄱㅣ S ㅅㅣㅂ S ㅅㅣㄴ S ㄷㅏ S ㄷㅏ
/home/beomgon/DeepSpeech/data/Zeroth/clips/131_003_2252.wav,ㅅㅏ ㅅㅐㅇ ㅎㅘㄹ ㅇㅡㄹ S ㅊㅣㅁ ㅎㅐ ㅎㅏㄴ ㄷㅏ ㅁㅕ S ㅂㅕㄴ ㅎㅗ ㅅㅏ S ㄷㅡㅇ ㅇㅡ ㄹㅗ S ㄱㅜ ㅅㅓㅇ ㄷㅚㄴ S ㄷㅏㄴ ㅊㅔ ㄱㅏ S ㅅㅗ ㅅㅗㅇ ㅇㅡㄹ S ㅈㅔ ㄱㅣ ㅎㅏ ㄱㅣ ㄹㅗ S ㅎㅐㅆ ㅅㅡㅂ ㄴㅣ ㄷㅏ
/home/beomgon/DeepSpeech/data/Zeroth/clips/131_003_2252.wav,ㅇㅣ ㅎㅐ ㄱㅘ ㅇㅢ S ㅊㅣ ㅁㅐ ㅎㅏㄴ S ㄷㅏㅇ ㅇㅡㄹ S ㅂㅓ ㄷㅡ ㄱㅏ S ㄷㅡㅇ ㅇㅡ ㄹㅗ S ㄱㅜ ㅅㅓㅇ ㅎㅏㄴ S ㅂㅏㄴ ㅅㅔ ㄱㅏ S ㅅㅗ ㅅㅗㅇ ㅇㅡㄹ S ㅈㅔ ㄱㅣ ㅎㅏ ㄱㅣ ㄹㅗ S ㅎㅐㅆ ㅅㅡㅂ ㄴㅣ ㄷㅏ
/home/beomgon/DeepSpeech/data/Zeroth/clips/208_003_0871.wav,ㅇㅣ ㄱㅓ ㅂㅗ ㄷㅏ S ㄷㅓ S ㅆㅏㄴ S ㅁㅜㄹ ㄱㅓㄴ ㄷㅗ S ㅇㅣㅆ ㄴㅡㄴ ㄷㅔ S ㅇㅗ S ㅊㅓㄴ ㅁㅏㄴ S ㅇㅝㄴ S ㅈㅓㅇ ㄷㅗ ㄴㅡㄴ S ㄴㅏㅈ ㅇㅏ ㅈㅣㄴ S ㄱㅔ S ㅇㅏ ㄴㅣㄴ ㄱㅏ
/home/beomgon/DeepSpeech/data/Zeroth/clips/208_003_0871.wav,ㅇㅣ ㄱㅓ ㅂㅗ ㄷㅏ S ㄷㅓ S ㅆㅏㄴ S ㅇㅜ ㄱㅜㄱ ㅇㅡㄹ S ㅇㅣㅆ ㄴㅡㄴ ㄷㅔ S ㅇㅗ S ㅊㅓㄴ ㅁㅏㄴ S ㅇㅝㄴ S ㅎㅜ ㅁㅜㄴ ㅇㅡㄴ S ㄴㅏ ㄹㅏ ㅇㅣㄴ ㅇㅣ S ㅇㅏ ㄴㅣ ㄷㅏ
/home/beomgon/DeepSpeech/data/Zeroth/clips/145_003_0869.wav,ㅅㅣㅂ S ㄱㅜ S ㅅㅔ ㄱㅣ S ㅊㅗ ㅇㅔ S ㅇㅕㅇ ㄱㅜㄱ S ㅇㅣㅇ ㄱㅡㄹ ㄹㅐㄴ ㄷㅡ ㅇㅘ S ㅅㅡ ㅋㅗ ㅌㅡㄹ ㄹㅐㄴ ㄷㅡ S ㅇㅞ ㅇㅣㄹ ㅅㅡ ㅇㅔ S ㅇㅣㅆ ㄷㅓㄴ S ㅇㅜㄴ ㅎㅏ ㄷㅡㄹ ㅇㅢ S ㄱㅣㄹ ㅇㅣ ㄹㅡㄹ S ㅁㅗ ㄷㅜ S ㅎㅏㅂ ㅎㅏ ㅁㅕㄴ S ㅇㅠㄱ ㅊㅓㄴ S ㅋㅣㄹ ㄹㅗ ㅁㅣ ㅌㅓ ㅇㅔ S ㄷㅏㄹ ㅎㅐㅆ ㅅㅡㅂ ㄴㅣ ㄷㅏ
/home/beomgon/DeepSpeech/data/Zeroth/clips/145_003_0869.wav,ㅅㅣㅂ S ㄱㅜ S ㅅㅔ ㄱㅣ S ㅊㅗ ㅇㅔ S ㅇㅕㅇ ㄱㅜㄱ ㅇㅣㄴ ㄱㅜ ㄹㅡㄹ S ㄷㅗ ㅇㅘ S ㅅㅡ ㅋㅗ ㅌㅡㄹ ㄹㅐㄴ ㄷㅡ S ㅇㅞ ㅇㅡㄹ S ㅅㅜ S ㅇㅣㅆ ㄷㅏ ㄱㅗ S ㄴㅏ ㄷㅡㄹ ㅇㅣ S ㄷㅐ ㄹㅣ S ㅇㅣ S ㅁㅗ ㄷㅜ ㅎㅏ ㅎㅏ ㅁㅕㄴ S ㅇㅠㄱ ㅊㅓㄴ S ㄱㅜ ㄹㅗ ㅁㅣ ㅌㅓ S ㄷㅏ ㅎㅐㅆ ㅅㅡㅂ ㄴㅣ ㄷㅏ
/home/beomgon/DeepSpeech/data/Zeroth/clips/158_003_1472.wav,ㄷㅏㅇ ㅅㅣㄴ ㅇㅡㄴ S ㅁㅗㅁ ㅇㅡ ㄹㅗ S ㅎㅏ ㄴㅡㄴ S ㅇㅣㄹ ㅇㅔ S ㄷㅐ ㅎㅐ S ㅇㅓ ㄸㅓㄴ S ㅅㅐㅇ ㄱㅏㄱ ㅇㅡㄹ S ㄱㅏ ㅈㅣ ㄱㅗ S ㅇㅣㅆ ㅅㅡㅂ ㄴㅣ ㄲㅏ
/home/beomgon/DeepSpeech/data/Zeroth/clips/158_003_1472.wav,ㅎㅏ ㅈㅣ ㅁㅏㄴ S ㅁㅗ ㅂㅜ ㄹㅗ S ㅎㅏ ㄴㅡ ㄴㅣㅁ ㅇㅔ S ㄷㅐ ㅎㅐ S ㅇㅓ ㄸㅓㄴ S ㅅㅐㅇ ㄱㅏㄱ ㅇㅡㄹ S ㄱㅏ ㅈㅣ ㄱㅗ S ㅇㅣㅆ ㅇㅡ ㄴㅣ ㄲㅏ S ㄲㅏ
/home/beomgon/DeepSpeech/data/Zeroth/clips/189_003_1563.wav,ㄴㅚ S ㅈㅗ ㅈㅣㄱ S ㅇㅣㄹ S ㄱㅡ ㄹㅐㅁ ㅇㅔ S ㅅㅜ ㅂㅐㄱ ㅁㅏㄴ S ㄱㅐ ㄱㅏ S ㅆㅏㅎ ㅇㅕ S ㅇㅣㅆ ㄱㅣ ㄷㅗ S ㅎㅐㅆ ㅅㅡㅂ ㄴㅣ ㄷㅏ
/home/beomgon/DeepSpeech/data/Zeroth/clips/189_003_1563.wav,ㅇㅏ ㅈㅜ S ㅅㅔ ㄱㅖ ㅇㅡㄹ ㅇㅔ S ㅁㅐ ㅇㅔ S ㅅㅜ ㅂㅐㄱ ㅁㅏㄴ S ㄱㅐ ㅇㅔ S ㅆㅏㅎ ㅇㅕ S ㅇㅣㅆ ㄱㅣ ㄷㅗ S ㅎㅐㅆ ㅅㅡㅂ ㄴㅣ ㄷㅏ
/home/beomgon/DeepSpeech/data/Zeroth/clips/210_003_1784.wav,ㄸㅐ ㄸㅐ ㄹㅗ S ㅇㅖ ㅅㅏㅇ ㅊㅣ S ㅁㅗㅅ ㅎㅏㄴ S ㅇㅣㄹ ㅇㅣ S ㅇㅣㄹ ㅇㅓ ㄴㅏㄹ S ㄱㅓㅅ ㅇㅡㄹ S ㄷㅐ ㅂㅣ ㅎㅐ ㅅㅓ S ㅅㅣ ㄱㅏㄴ ㅇㅡㄹ S ㅇㅕ ㅇㅠ S ㅇㅣㅆ ㄱㅔ S ㄱㅖ ㅎㅚㄱ ㅎㅏ ㄴㅡㄴ S ㄱㅓㅅ ㅇㅣ S ㄷㅗ ㅇㅜㅁ ㅇㅣ S ㄷㅚㅂ ㄴㅣ ㄷㅏ
/home/beomgon/DeepSpeech/data/Zeroth/clips/210_003_1784.wav,ㄸㅐ ㄸㅐ ㄹㅗ S ㅇㅖ ㅅㅏㅇ ㅊㅣ S ㅁㅗㅅ ㅎㅏㄴ S ㅇㅣㄹ ㅇㅣ S ㅇㅕ ㅎㅏㄹ S ㄱㅓㅅ ㅇㅔ S ㄷㅐ ㅂㅣ ㅎㅐ ㅅㅓ S ㅅㅣ ㄱㅏㄴ ㅇㅡㄹ S ㅇㅕ ㅇㅠ ㄱㅣ ㄱㅣ S ㅎㅏ ㄴㅡ ㄱㅓㅅ ㅇㅣ ㄷㅗ S ㅇㅣ S ㄷㅚ ㄴㅣ ㄷㅏ ㄹㅏ
/home/beomgon/DeepSpeech/data/Zeroth/clips/124_003_1086.wav,ㄱㅘ ㅎㅏㄱ ㅇㅡㄴ S ㄷㅏㅂ ㅇㅡㄹ S ㅊㅏㅈ ㅇㅡ ㄹㅕ ㄱㅗ S ㅇㅐ ㅆㅡ ㅈㅣ ㅁㅏㄴ S ㅇㅓ ㄸㅓㄴ S ㅁㅜㄴ ㅈㅔ ㅇㅔ S ㄷㅐ ㅎㅏㄴ S ㄷㅏㅂ ㅇㅡㄹ S ㅊㅏㅈ ㅇㅡ ㅁㅕㄴ S ㄸㅗ S ㄷㅏ ㄹㅡㄴ S ㅁㅜㄴ ㅈㅔ ㄱㅏ S ㅅㅐㅇ ㄱㅣ ㄴㅡㄴ S ㄱㅕㅇ ㅇㅜ ㄱㅏ S ㄴㅓ ㅁㅜ ㄴㅏ S ㅁㅏㄶ ㅅㅡㅂ ㄴㅣ ㄷㅏ
/home/beomgon/DeepSpeech/data/Zeroth/clips/124_003_1086.wav,ㅇㅣ ㅇㅡㄴ S ㅂㅏㄱ ㅇㅡㄹ S ㅊㅏ ㅈㅣ ㅎㅏ ㄱㅗ S ㅎㅐㅆ ㅇㅡ ㅈㅣ ㅁㅏㄴ S ㅇㅓ ㄸㅓㄴ S ㅁㅜㄴ ㅈㅔ ㅇㅔ S ㄷㅐ ㅎㅏㄴ S ㅅㅏ ㄷㅡㄹ S ㅊㅏ ㅇㅣ ㅇㅣㄴ S ㄷㅗㄹ ㅇㅏ ㅇㅔ S ㅁㅜㄴ ㅈㅔ ㄱㅏ S ㅅㅐㅇ ㄱㅣ ㄴㅡㄴ S ㄱㅕㅇ ㅇㅜ ㄱㅏ S ㄴㅓ ㅁㅜ ㄴㅏ S ㅁㅏㄶ ㅅㅡㅂ ㄴㅣ ㄷㅏ
/home/beomgon/DeepSpeech/data/Zeroth/clips/210_003_1435.wav,ㅇㅠ ㅁㅕㅇ S ㅅㅡ ㅌㅏ ㄷㅡㄹ ㅇㅢ S ㅊㅚ ㅅㅣㄴ S ㄷㅏ ㅇㅣ ㅇㅓ ㅌㅡ S ㅂㅣ ㅂㅓㅂ ㅇㅡ ㄹㅗ S ㅇㅏㄹ ㄹㅕ ㅈㅣ ㅈㅏ S ㅇㅕㅇ ㄱㅜㄱ ㅇㅢ S ㅁㅏㄶ ㅇㅡㄴ S ㅇㅕ ㅅㅓㅇ ㄷㅡㄹ ㅇㅣ S ㄱㅡㄹ ㄹㅜ ㅌㅔㄴ S ㅍㅡ ㄹㅣ S ㅋㅗ ㄴㅓ ㅇㅔ S ㅁㅗㄹ ㄹㅕ ㄷㅡㄴ S ㄱㅓㅅ ㅇㅣ ㄷㅏ
/home/beomgon/DeepSpeech/data/Zeroth/clips/210_003_1435.wav,ㅇㅣ ㅁㅕㅇ ㅌㅏ ㅇㅢ S ㅊㅚ ㅅㅣㄴ S ㄷㅏ S ㅇㅕ ㅌㅡ S ㅂㅣ ㅂㅓㅂ ㅇㅡ ㄹㅗ S ㅇㅏㄹ ㄹㅕ S ㄷㅏㄹ ㄹㅓ ㄱㅜ ㅇㅢ S ㅁㅏㄶ ㅇㅡㄴ S ㅇㅕ ㅅㅓㅇ ㅇㅣ S ㄱㅓㄹ ㄹㅗ S ㅅㅐㄴ ㅍㅡ ㄹㅣ S ㅋㅗ ㄴㅓ ㅇㅔ S ㅁㅗㄹ ㄹㅕ ㄷㅡㄴ S ㄱㅓㅅ ㅇㅣ ㄷㅏ
/home/beomgon/DeepSpeech/data/Zeroth/clips/152_003_2232.wav,ㅇㅣ S ㅅㅏㅁ S ㄷㅏㄹ ㄹㅓ ㄹㅡㄹ S ㄷㅓ S ㄷㅏㄹ ㄹㅏ ㄱㅗ S ㅎㅐ ㅅㅓ S ㄱㅗㅇ ㅎㅏㅇ ㄱㅕㅇ ㅊㅏㄹ ㄷㅡㄹ ㄱㅘ S ㅁㅏㄹ ㄷㅏ ㅌㅜㅁ ㅇㅡㄹ S ㅂㅓㄹ ㅇㅣ ㄴㅡㄴ S ㄱㅕㅇ ㅇㅜ ㄴㅡㄴ S ㅈㅗㅇ ㅈㅗㅇ S ㅂㅘㅆ ㅈㅣ ㅁㅏㄴ S ㄱㅕㄹ ㄱㅜㄱ S ㄷㅐ ㅂㅜ ㅂㅜㄴ S ㅇㅛ ㄱㅜ ㅎㅏ ㄴㅡㄴ S ㄷㅐ ㄹㅗ S ㅁㅕㅊ S ㅍㅜㄴ S ㄷㅓ S ㅈㅝ ㅅㅓ S ㅁㅜㄴ ㅈㅔ ㄹㅡㄹ S ㅎㅐ ㄱㅕㄹ ㅎㅐㅆ ㄷㅏ
/home/beomgon/DeepSpeech/data/Zeroth/clips/152_003_2232.wav,ㅇㅣ S ㅅㅏㅁ S ㄷㅏㄹ ㄹㅓ ㄹㅡㄹ S ㄷㅓ S ㄷㅏㄹ ㄹㅏ ㄱㅗ S ㅎㅐ ㅅㅓ S ㄱㅗㅇ ㅎㅏㅇ ㄱㅕㅇ ㅊㅏㄹ ㄱㅣ ㄱㅏ S ㄱㅏ ㄹㅕ ㅌㅜㅁ ㅇㅡㄹ S ㅂㅓㄹ ㅇㅣㄴ ㅇㅣ S ㄷㅏ ㅇㅜㄴ S ㅈㅗㅇ ㅈㅗㅇ S ㅎㅏ ㅈㅣ ㅁㅏㄴ S ㄱㅕㄹ ㄱㅜㄱ S ㄷㅐ ㅂㅜ ㅂㅜㄴ S ㅇㅛ ㅇㅝㄴ ㄷㅡㄹ ㄹㅗ S ㄱㅕㅂ ㅇㅡㄴ S ㅈㅓ ㅅㅓ ㅅㅓ S ㅁㅜㄴ ㅈㅔ ㄹㅡㄹ S ㅎㅐ ㄱㅕㄹ ㅎㅐㅆ ㄷㅏ
/home/beomgon/DeepSpeech/data/Zeroth/clips/210_003_2774.wav,ㅁㅕㅊ S ㄱㅏ ㅈㅣ S ㄱㅣ ㄴㅡㅇ ㅇㅡㄹ S ㅇㅖ ㄹㅗ S ㄷㅡㄹ ㅁㅕㄴ S ㅊㅓㅅ ㅉㅐ ㄹㅗ S ㅎㅐ ㅋㅣㅇ S ㅂㅏㅇ ㅈㅣ S ㅁㅣㅊ S ㅈㅏㅇ ㄴㅏㄴ S ㅊㅏ ㄷㅏㄴ S ㄱㅣ ㄴㅡㅇ ㅇㅣ ㄷㅏ
/home/beomgon/DeepSpeech/data/Zeroth/clips/210_003_2774.wav,ㅇㅏ ㄱㅏ ㅈㅣ S ㅇㅣ ㅎㅜ S ㅇㅣㄹ ㄹㅗ S ㄷㅡㄹ ㅁㅕㄴ S ㅊㅓㅅ ㅉㅐ ㄹㅗ S ㅎㅐ ㅋㅣㅇ S ㅂㅏㅇ ㅈㅣ ㅇㅢ S ㅈㅏㅇ ㄴㅏㄴ S ㅊㅏ ㄷㅏㄴ S ㄱㅣ ㄴㅡㅇ ㅇㅣ ㄷㅏ S ㄷㅏ
/home/beomgon/DeepSpeech/data/Zeroth/clips/127_003_2582.wav,ㅇㅣ ㅊㅓㄴ S ㅅㅣㅂ S ㅅㅏ S ㄴㅕㄴ S ㅅㅣㅂ S ㅇㅣ S ㅇㅝㄹ ㅇㅔ S ㅂㅜㄴ ㅇㅑㅇ ㄷㅚㄴ S ㅅㅣ ㅎㅡㅇ ㅁㅗㄱ ㄱㅏㅁ ㅎㅗ ㅂㅏㄴ ㅂㅔ ㄹㅡ ㄷㅣ ㅇㅜㅁ S ㅍㅏㄹ ㅅㅣㅂ S ㅅㅏ S ㅉㅓㅁ S ㅇㅠㄱ S ㅊㅣㄹ S ㅈㅔ ㄱㅗㅂ ㅁㅣ ㅌㅓ ㄴㅡㄴ S ㅇㅣ ㅊㅓㄴ S ㅁㅏㄴ S ㅇㅔ ㅅㅓ S ㅅㅏ ㅊㅓㄴ S ㅁㅏㄴ ㅇㅝㄴ ㅇㅢ S ㅇㅜㅅ ㄷㅗㄴ ㅇㅣ S ㅂㅜㅌ ㅇㅡㄴ S ㅅㅏㅁ S ㅇㅓㄱ S ㅅㅏ ㅊㅓㄴ S ㅁㅏㄴ ㅇㅝㄴ ㄷㅐ ㅇㅔ S ㄱㅓ ㄹㅐ ㄷㅙㅆ ㄷㅏ
/home/beomgon/DeepSpeech/data/Zeroth/clips/127_003_2582.wav,ㅇㅣ ㅊㅓㄴ S ㅅㅣㅂ S ㅅㅏ S ㄴㅕㄴ S ㅅㅣㅂ S ㅇㅣ S ㅇㅝㄹ ㅇㅔ S ㅂㅜㄴ ㅇㅑㅇ ㄷㅚㄴ S ㅅㅣ S ㅁㅗㄱ ㄱㅏㅁ ㅎㅗ ㅂㅏㄴ ㅂㅔ ㄹㅡ S ㅇㅣ ㅇㅕㅇ S ㅍㅏㄹ ㅅㅣㅂ S ㅅㅏ S ㅉㅓㅁ S ㅇㅠㄱ S ㅊㅣㄹ S ㅈㅔ ㄱㅗㅂ S ㅈㅓㄴ ㄴㅏㄹ S ㅇㅣ ㅊㅓㄴ S ㅁㅏㄴ S ㅇㅔ ㅅㅓ S ㅅㅏ ㅊㅓㄴ S ㅁㅏㄴ ㅇㅣ S ㅁㅗ ㄷㅗ S ㅇㅣ S ㅂㅜ S ㅅㅏ ㅇㅓㅂ ㅅㅏ ㅊㅜㄴ ㅁㅏㄴ ㅇㅝㄴ ㅇㅔ S ㄱㅓㄹ ㄹㅣㄴ ㄷㅏ
/home/beomgon/DeepSpeech/data/Zeroth/clips/210_003_2999.wav,ㄱㅜㄱ ㄹㅣㅂ S ㅂㅏㄱ ㅁㅜㄹ ㄱㅘㄴ ㅇㅢ S ㅇㅕㄴ ㄱㅜ ㅇㅝㄴ S ㅌㅔ ㄹㅔ ㅈㅏ S ㅂㅗㄴ ㅌㅗ ㄹㅡ ㅊㅣ ㅎㅣ ㄴㅡㄴ S ㅈㅏ ㅅㅣㄴ ㅇㅢ S ㅈㅓ ㅅㅓ S ㅁㅣㄷ ㅇㅡㅁ S ㄸㅐ ㅁㅜㄴ ㅇㅔ S ㅌㅜ ㅇㅗㄱ ㄷㅚ ㄷㅏ S ㅇㅏ ㅇㅜ ㅅㅠ ㅂㅣ ㅊㅡ S ㄱㅏㅇ ㅈㅔ S ㅅㅜ ㅇㅛㅇ ㅅㅗ ㅇㅢ S ㅇㅕ ㅎㅗ ㅇㅘ ㅇㅢ S ㅈㅡㅇ ㅇㅣㄴ S ㅇㅔ ㅅㅓ S ㅇㅣ ㄹㅓㅎ ㄱㅔ S ㅆㅓㅆ ㅅㅡㅂ ㄴㅣ ㄷㅏ
/home/beomgon/DeepSpeech/data/Zeroth/clips/210_003_2999.wav,ㄱㅜㄱ ㄹㅣㅂ S ㅂㅏㄱ ㅁㅜㄹ ㄱㅘㄴ ㅇㅢ S ㅇㅕㄴ ㄱㅜ ㅇㅝㄴ S ㅌㅔ ㄹㅔ ㅈㅏ S ㅂㅗㄴ ㅌㅗ ㄹㅡ ㅊㅣ ㅎㅣ ㄴㅡㄴ S ㅈㅏ ㅅㅣㄴ ㅇㅢ S ㅈㅓ ㅅㅓ ㅎㅣ S ㅈㅜㅇ ㅅㅔ ㅇㅔ S ㅌㅜ ㅇㅗㄱ ㄷㅚ ㄷㅏ S ㅇㅗ ㅅㅣㅂ S ㅇㅣ S ㅊㅡㄱ S ㄱㅏ ㄱㅖ S ㅈㅜ ㅇㅛ ㅅㅓ S ㅇㅣ ㅇㅓ ㅇㅘ ㅇㅢ S ㅈㅡㅇ ㅇㅣㄴ ㅇㅔ ㅅㅓ S ㅇㅣ ㄹㅓㅎ ㄱㅔ S ㅆㅓㅆ ㅅㅡㅂ ㄴㅣ ㄷㅏ
/home/beomgon/DeepSpeech/data/Zeroth/clips/145_003_0116.wav,ㅇㅏ ㅇㅣ ㄹㅓ ㄴㅣ ㅎㅏ ㄱㅔ ㄷㅗ S ㅎㅡㄴ ㅎㅣ S ㅅㅏ ㄹㅏㅁ ㄷㅡㄹ ㅇㅡㄴ S ㅂㅔ ㄷㅡㄹ ㄹㅔ ㅎㅔㅁ ㅇㅢ S ㅂㅕㄹ ㅇㅣ ㄹㅏ S ㅂㅜ ㄹㅡ ㄴㅡㄴ S ㅈㅏㅇ ㅅㅣㄱ ㅇㅡㄹ S ㅋㅡ ㄹㅣ ㅅㅡ ㅁㅏ ㅅㅡ ㅌㅡ ㄹㅣ S ㄲㅗㄱ ㄷㅐ ㄱㅣ ㅇㅔ S ㄷㅏㄹ ㅇㅏ S ㄴㅗㅎ ㅅㅡㅂ ㄴㅣ ㄷㅏ
/home/beomgon/DeepSpeech/data/Zeroth/clips/145_003_0116.wav,ㅇㅏ ㅇㅣ ㄹㅓ ㄴㅣ ㄱㅣ ㄷㅗ S ㅁㅣ ㅅㅏ ㄷㅡㄹ ㅇㅡㄴ S ㅇㅕ ㅇㅣㄹ ㄹㅔ ㅇㅣ S ㄱㅓㄹ ㄹㅣ ㄹㅏ S ㅂㅜ ㄹㅡ ㄴㅡㄴ S ㅈㅏㅇ ㅅㅣㄱ ㅇㅡㄹ S ㅋㅡ ㄹㅣ ㅅㅡ ㅁㅏ ㅅㅡ ㅁㅏ ㅅㅡ ㅌㅡ ㄹㅣ S ㄲㅗㄱ ㄷㅐ ㄱㅣ ㅇㅔ S ㄷㅏㄹ ㅇㅏ S ㄴㅗㅎ ㅅㅡㅂ ㄴㅣ ㄷㅏ
/home/beomgon/DeepSpeech/data/Zeroth/clips/168_003_0255.wav,ㅇㅐ ㅊㅗ S ㅊㅚ ㄱㅗ ㅇㅟ ㅇㅝㄴ S ㅊㅜㄹ ㅁㅏ ㄹㅡㄹ S ㅇㅕㅁ ㄷㅜ ㅇㅔ S ㄷㅝㅆ ㅈㅣ ㅁㅏㄴ S ㅊㅚ ㄱㅗ ㅇㅟ ㅇㅝㄴ ㅈㅔ ㄱㅏ S ㅍㅖ ㅈㅣ ㄷㅚ ㅁㅕㄴ ㅅㅓ S ㄷㅏㅇ S ㄷㅐ ㅍㅛ S ㅊㅜㄹ ㅁㅏ ㄲㅏ ㅈㅣ S ㄱㅗ ㅁㅣㄴ ㅎㅏ ㄱㅔ S ㄷㅚㄴ S ㄱㅓㅅ ㅇㅣ ㄹㅏ ㄱㅗ S ㅈㅓㄴ ㅎㅐㅆ ㄷㅏ
/home/beomgon/DeepSpeech/data/Zeroth/clips/168_003_0255.wav,ㅇㅣ ㅎㅜ S ㅊㅚ ㄱㅗ S ㅇㅣ S ㅅㅣㄹ ㅁㅜㄹ S ㅇㅕㄴ ㄷㅐ S ㅈㅗ ㅈㅣㄱ ㅇㅡㄴ S ㅊㅚ ㄱㅗ ㅇㅟ ㅇㅝㄴ ㅈㅔ ㄱㅏ S ㅍㅖ ㅈㅣ ㄷㅚ ㄴㅡㄴ S ㄷㅏㅇ S ㄷㅐ ㅍㅛ S ㅊㅜㄹ ㅁㅏ ㄲㅏ ㅈㅣ S ㄱㅗ ㅁㅣㄴ ㅎㅏ ㄱㅔ S ㄷㅚㄴ S ㄱㅓㅅ ㅇㅣ ㄹㅏ ㄱㅗ S ㅈㅓㄴ ㅎㅐㅆ ㄷㅏ
/home/beomgon/DeepSpeech/data/Zeroth/clips/125_003_1898.wav,ㅍㅏ ㅇㅓㅂ ㅇㅢ S ㅇㅕㅇ ㅎㅑㅇ ㅇㅡ ㄹㅗ S ㅈㅓㄴ ㅊㅓㄹ ㅇㅣ S ㅈㅣ ㅇㅕㄴ ㄷㅚ ㄴㅡㄴ S ㄷㅡㅇ S ㅂㅜㄹ ㅍㅕㄴ ㅇㅡㄹ S ㄱㅕㄲ ㅇㅡㄴ S ㅅㅣ ㅁㅣㄴ ㄷㅡㄹ ㅇㅣ S ㅁㅏㄶ ㅇㅏㅆ ㅇㅡㄹ S ㄱㅓㅂ ㄴㅣ ㄷㅏ
/home/beomgon/DeepSpeech/data/Zeroth/clips/125_003_1898.wav,ㅍㅏ ㅇㅓㅂ ㅇㅢ S ㅇㅕㅇ ㅎㅑㅇ ㅇㅡ ㄹㅗ S ㅈㅓㄴ ㅊㅓㄹ ㅇㅣ S ㅈㅣ ㅇㅕㄴ ㄷㅚ ㄴㅡㄴ S ㄷㅡㅇ S ㅂㅜㄹ ㅍㅕㄴ ㅇㅡㄹ S ㄱㅕㅇ ㅇㅜ S ㅅㅣㄴ ㅇㅣ S ㅁㅣ ㄹㅣ S ㅁㅏㄶ ㅇㅏㅆ ㅇㅡㄹ S ㄱㅓㅅ S ㅇㅏ
/home/beomgon/DeepSpeech/data/Zeroth/clips/163_003_0830.wav,ㅂㅜ ㅁㅗ ㄱㅏ S ㄴㅗ ㅎㅜ ㄷㅐ ㅂㅣ ㄷㅗ S ㅍㅗ ㄱㅣ ㅎㅏ ㄱㅗ S ㅎㅏㄱ ㅇㅝㄴ ㅇㅔ S ㅇㅠ ㅎㅏㄱ ㅇㅔ S ㅅㅏ ㄱㅛ ㅇㅠㄱ ㅂㅣ ㄹㅡㄹ S ㄷㅡㄹ ㅇㅕ ㄷㅗ S ㅇㅏ ㅇㅣ ㄷㅡㄹ ㅇㅔ ㄱㅔㄴ S ㅁㅣ ㄹㅐ ㄱㅏ S ㅂㅗ ㅇㅣ ㅈㅣ S ㅇㅏㄶ ㅅㅡㅂ ㄴㅣ ㄷㅏ
/home/beomgon/DeepSpeech/data/Zeroth/clips/163_003_0830.wav,ㅇㅏ ㅁㅜ ㄱㅏ ㄷㅗ S ㄷㅐ ㅂㅣ ㄷㅗ S ㅍㅗ ㄱㅣ ㅎㅏ ㄱㅗ S ㅎㅏㄱ ㅂㅜ ㄹㅣ S ㅇㅢ ㅇㅝㄴ ㅇㅣ S ㅅㅏ ㅇㅣ S ㅂㅣ ㄹㅡㄹ S ㄷㅡㄹ ㅇㅕ ㄷㅗ S ㅇㅏ ㄷㅡㄹ ㅇㅔ ㄱㅔㄴ S ㅁㅣ ㄹㅐ ㄱㅏ S ㅂㅗ ㅇㅣ ㅈㅣ S ㅇㅏㄶ ㅅㅡㅂ ㄴㅣ ㄷㅏ
/home/beomgon/DeepSpeech/data/Zeroth/clips/198_003_0833.wav,ㅇㅜ ㄹㅣ S ㅅㅓㅇ ㄷㅏㅇ S ㅂㅣㄴ ㅊㅔㄴ ㅅㅣ ㅇㅗ ㅎㅚ ㅇㅔ ㅅㅓ ㄴㅡㄴ S ㅁㅐ ㅈㅜ S ㅌㅗ ㅇㅛ ㅇㅣㄹ ㅁㅏ ㄷㅏ S ㅅㅓㅇ ㄷㅏㅇ S ㅈㅜ ㅂㅏㅇ ㅇㅔ ㅅㅓ S ㅂㅏㄴ ㅊㅏㄴ ㅇㅡㄹ S ㄴㅔ S ㄱㅏ ㅈㅣ S ㅈㅓㅇ ㄷㅗ S ㅈㅣㄱ ㅈㅓㅂ S ㅁㅏㄴ ㄷㅡㄹ ㅇㅓ S ㅇㅣ ㅅㅣㅂ S ㅇㅕ S ㄱㅏ ㄱㅜ ㅇㅔ S ㅂㅐ ㄷㅏㄹ ㅎㅏ ㄱㅗ S ㅇㅣㅆ ㅅㅡㅂ ㄴㅣ ㄷㅏ
/home/beomgon/DeepSpeech/data/Zeroth/clips/198_003_0833.wav,ㅇㅜ ㄹㅣ S ㅅㅓㅇ ㄷㅏㅇ S ㅂㅣㄴ ㅊㅔㄴ ㅅㅣ ㅇㅗ ㅇㅔ S ㅂㅓ ㄴㅡㄴ S ㅁㅐ ㅈㅜ ㅍㅗ ㄹㅡㄹ S ㅁㅏ ㄷㅏ S ㅅㅓㅇ ㄷㅏㅇ S ㅈㅜ ㅂㅏㅇ ㅇㅔ ㅅㅓ S ㅂㅏㄴ ㅊㅏㄴ ㄴㅡㄴ S ㄴㅐ ㄱㅏㄱ ㅇㅣ S ㄴㅓㅁ ㅂㅜ ㅈㅣㄱ S ㅈㅓㅁ S ㅁㅏㄴ ㄷㅡㄹ ㅇㅓ S ㅇㅣ ㅅㅣㅂ S ㅇㅕ S ㄱㅏ ㄱㅜ ㅇㅔ S ㅂㅐ ㄷㅏㄹ ㅎㅏ ㄱㅗ S ㅇㅣㅆ ㅅㅡㅂ ㄴㅣ ㄷㅏ
/home/beomgon/DeepSpeech/data/Zeroth/clips/184_003_2930.wav,ㅊㅓ ㅂㅓㄹ ㅇㅡㄴ S ㅇㅓㅄ ㅇㅡㄹ ㅈㅣ ㅇㅓㄴ ㅈㅓㅇ S ㅅㅏ ㄱㅓㄴ ㅇㅢ S ㄱㅕㅇ ㅇㅟ ㅇㅘ S ㅅㅣㄹ ㅊㅔ ㅈㅓㄱ S ㅈㅣㄴ ㅅㅣㄹ ㅇㅡㄴ S ㅁㅕㅇ ㅁㅕㅇ ㅂㅐㄱ ㅂㅐㄱ ㅎㅏ ㄱㅔ S ㅅㅜ ㅅㅏ ㅎㅐ ㅈㅜ ㅅㅣ ㄱㅣ ㄹㅡㄹ S ㅎㅕㅇ ㅅㅏ ㄴㅣㅁ ㄷㅡㄹ ㄲㅔ S ㅂㅜ ㅌㅏㄱ ㄷㅡ ㄹㅣㅂ ㄴㅣ ㄷㅏ
/home/beomgon/DeepSpeech/data/Zeroth/clips/184_003_2930.wav,ㄱㅡ ㄱㅓㄹ ㄹㅗ S ㅇㅓㅄ ㅇㅡㄹ ㅈㅣ ㅇㅓㄴ ㅈㅓㅇ S ㅅㅏ ㄱㅓㄴ ㅇㅢ S ㄱㅕㅇ ㅇㅟ ㅇㅘ S ㅅㅣㄹ ㅊㅔ ㅈㅓㄱ S ㅈㅣㄴ ㅅㅣㄹ ㅇㅡㄴ S ㅁㅕㅇ ㅁㅕㅇ ㅂㅐㄱ ㅂㅐㄱ ㅎㅏ ㄱㅔ S ㅅㅜ ㅅㅏ ㅎㅐ ㅈㅜ ㅅㅣ ㄱㅣ S ㅅㅏㅇ ㅅㅏㅇ ㅇㅣㄴ ㄷㅔ ㅈㅣ S ㅅㅏ ㅇㅣㅂ ㄴㅣ ㄷㅏ
