wav_filename,text
/home/beomgon/DeepSpeech/data/Zeroth/clips/201_003_0130.wav,ㄱㅐㄴ S ㅇㅕㄹ ㅊㅏ ㄴㅡㄴ S ㅁㅜ ㅇㅕㄱ ㅇㅡㄹ S ㅊㅗㄱ ㅈㅣㄴ ㅎㅏ ㄱㅗ S ㅅㅔ ㄱㅖ ㅈㅓㄱ ㅇㅡ ㄹㅗ S ㅇㅠ ㅁㅕㅇ ㅎㅏㄴ S ㄱㅣ ㅊㅏ S ㅇㅕ ㅎㅐㅇ ㅇㅡㄹ S ㅎㅏ ㄱㅔ S ㅎㅐ S ㅈㅜ ㅇㅓㅆ ㅇㅡㄹ S ㅃㅜㄴ S ㅇㅏ ㄴㅣ ㄹㅏ S ㅇㅗ ㅈㅣ S ㅎㅏㄴ ㄱㅏ ㅇㅜㄴ ㄷㅔ ㅇㅔ ㅅㅓ ㄷㅗ S ㅎㅕㄴ ㄷㅐ S ㅅㅔ ㄱㅖ ㅇㅢ S ㅎㅏㄴ S ㄷㅏㄴ ㅁㅕㄴ ㅇㅡㄹ S ㅇㅕㅅ ㅂㅗㄹ S ㅅㅜ S ㅇㅣㅆ ㄱㅔ S ㅎㅐ S ㅈㅜ ㅇㅓㅆ ㅅㅡㅂ ㄴㅣ ㄷㅏ
/home/beomgon/DeepSpeech/data/Zeroth/clips/201_003_0130.wav,ㄱㅐㄴ S ㅇㅕㄹ ㅊㅏ ㄴㅡㄴ S ㅁㅜ ㅇㅕㄱ ㅇㅡㄹ S ㅊㅗㄱ ㅈㅣㄴ ㅎㅏ ㄱㅗ S ㅅㅔ ㄱㅖ ㅈㅓㄱ ㅇㅡ ㄹㅗ S ㅇㅠ ㅁㅕㅇ ㅎㅏㄴ S ㄱㅣ ㅊㅏ S ㅇㅕ ㅎㅐㅇ ㅇㅡㄹ S ㅎㅏ ㄱㅔ S ㅎㅐ S ㅈㅜ ㅇㅓㅆ ㅇㅡㄹ S ㅃㅜㄴ S ㅇㅏ ㄱㅏ S ㅇㅗ ㅈㅜ ㅇㅣ S ㅎㅏㄴ S ㄱㅏ ㅇㅜㄴ ㄷㅔ ㅇㅔ ㅅㅓ ㄷㅗ S ㅎㅕㄴ ㄷㅐ S ㅅㅔ ㄱㅖ ㅇㅢ S ㅎㅏㄴ S ㄷㅏㄴ ㅁㅕㄴ ㅇㅡㄹ S ㅇㅕㅅ ㅂㅗㄹ S ㅅㅜ ㄱㅣ ㅇㅔ S ㅈㅜ ㅇㅓㅆ ㅅㅡㅂ ㄴㅣ ㄷㅏ
/home/beomgon/DeepSpeech/data/Zeroth/clips/145_003_1150.wav,ㅎㅏㄴ ㅈㅣㄴ ㅎㅐ ㅇㅜㄴ ㅇㅢ S ㅈㅣ ㅈㅜ ㅎㅚ ㅅㅏ ㅇㅣㄴ S ㅎㅏㄴ ㅈㅣㄴ ㅎㅐ ㅇㅜㄴ ㅎㅗㄹ ㄷㅣㅇ ㅅㅡ ㄹㅡㄹ S ㅇㅣ ㄲㅡㄹ ㅇㅓㅆ ㄷㅓㄴ S ㅈㅗ ㅇㅛㅇ ㅁㅣㄴ S ㅈㅓㄴ S ㄷㅐ ㅍㅛ ㄷㅗ S ㅇㅕㄴ ㄷㅐ S ㅊㅐㄱ ㅇㅣㅁ ㅇㅔ ㅅㅓ S ㅂㅓㅅ ㅇㅓ ㄴㅏㄹ S ㅅㅜ S ㅇㅓㅄ ㄷㅏ ㄴㅡㄴ S ㅈㅣ ㅈㅓㄱ ㅇㅡㄹ S ㅂㅏㄷ ㄴㅡㄴ ㄷㅏ
/home/beomgon/DeepSpeech/data/Zeroth/clips/145_003_1150.wav,ㅎㅏㄴ ㅈㅣㄴ ㅎㅐ ㅇㅜㄴ ㅇㅢ S ㅈㅣ ㅈㅜ ㅎㅚ ㅅㅏ ㅇㅣㄴ S ㅎㅏㄴ ㅈㅣㄴ ㅎㅐ ㅇㅜㄴ ㅎㅗㄹ ㄷㅣㅇ ㅅㅡ ㅇㅔ S ㄲㅡㄹ ㅇㅓㅆ ㄷㅓㄴ S ㅈㅜ ㅁㅣㄴ S ㅈㅓㄴ S ㄷㅐ ㅍㅛ ㄷㅗ S ㅇㅕㄴ ㄷㅐ S ㅊㅐㄱ ㅇㅣㅁ ㅇㅔ ㅅㅓ S ㅂㅓㅅ ㅇㅓ ㄴㅏㄹ S ㅅㅜ S ㅇㅓㅄ ㄷㅏ ㄴㅡㄴ S ㅈㅣ ㅈㅓㄱ ㅇㅡㄹ S ㅂㅏㄷ ㄴㅡㄴ S ㅈㅏ ㄹㅏ
/home/beomgon/DeepSpeech/data/Zeroth/clips/210_003_1643.wav,ㅎㅕㄴ ㅈㅐ S ㅂㅐㄱ S ㅍㅏㄹ ㅅㅣㅂ S ㅋㅣㄹ ㄹㅗ ㄱㅡ ㄹㅏㅁ ㅇㅔ S ㄷㅏㄹ ㅎㅏ ㄴㅡㄴ S ㅇㅕㄱ ㄱㅣ ㄹㅡㄹ S ㄷㅡㄹ S ㅅㅜ S ㅇㅣㅆ ㅇㅡ ㅁㅕ S ㄱㅏ ㄴㅡㅇ ㅎㅏㄴ S ㄷㅓ S ㅁㅜ ㄱㅓ ㅇㅜㄴ S ㄱㅓㅅ ㅇㅡㄹ S ㄷㅡㄹ ㄱㅗ S ㅅㅣㅍ ㄷㅏ ㄱㅗ S ㅁㅏㄹ ㅎㅐㅆ ㄷㅏ
/home/beomgon/DeepSpeech/data/Zeroth/clips/210_003_1643.wav,ㅎㅕㄴ ㅈㅐ S ㅂㅐㄱ S ㅍㅏㄹ ㅅㅣㅂ S ㅋㅣㄹ ㄹㅗ ㄱㅡ ㄹㅏㅁ ㅇㅔ S ㄷㅏㄹ ㅎㅏ ㄴㅡㄴ S ㅇㅕㄱ ㄱㅣ ㄹㅡㄹ S ㄷㅡㄹ S ㅅㅜ S ㅇㅣㅆ ㅇㅡ ㅁㅕ S ㄱㅏ ㄴㅡㅇ ㅎㅏㄴ S ㄷㅜ ㄱㅗ S ㅇㅝㄴ ㄱㅓㅅ ㅇㅡㄹ S ㄷㅡㄹ ㄱㅗ S ㅅㅣㅍ ㄷㅏ ㄱㅗ S ㅁㅏㄹ ㅎㅐㅆ ㄷㅏ
/home/beomgon/DeepSpeech/data/Zeroth/clips/193_003_2301.wav,ㄴㅏㄴ ㅁㅣㄴ ㄷㅡㄹ S ㅈㅜㅇ ㅇㅔ ㄴㅡㄴ S ㅍㅗㄴ S ㄹㅣㅇ ㄱㅔㄴ S ㅂㅐㄱ ㅈㅏㄱ ㄷㅗ S ㄲㅣ ㅇㅕ S ㅇㅣㅆ ㅇㅓㅆ ㄴㅡㄴ ㄷㅔ S ㅇㅜ ㄹㅣ ㄱㅏ S ㅇㅏㄹ ㄱㅣ ㄹㅗ ㄴㅡㄴ S ㄱㅡ ㄴㅡㄴ S ㅇㅣ ㅈㅓㄴ S ㄷㅗㄱ ㅇㅣㄹ S ㅎㅘㅇ ㅈㅔ ㅇㅢ S ㅅㅗㄴ ㅈㅏ ㅇㅕㅆ ㅅㅡㅂ ㄴㅣ ㄷㅏ
/home/beomgon/DeepSpeech/data/Zeroth/clips/193_003_2301.wav,ㄴㅏㄴ ㅁㅣㄴ ㄷㅡㄹ S ㅈㅜㅇ ㅇㅔ ㄴㅡㄴ S ㅍㅗㄴ S ㄹㅣㅇ ㄱㅔㄴ S ㅂㅐㄱ ㅈㅏㄱ ㄷㅗ S ㄲㅣ ㅇㅕ S ㅇㅣㅆ ㅇㅓㅆ ㄴㅡㄴ ㄷㅔ S ㅇㅜ ㄹㅣ ㄱㅏ S ㅇㅏㄹ ㄱㅣ ㄹㅗ ㄴㅡㄴ S ㄱㅡ ㄴㅡㄴ S ㅇㅣ ㅈㅓㄴ S ㄷㅗㄱ ㅇㅣㄹ S ㅎㅘㅇ ㅈㅔ ㅇㅢ S ㅅㅗㄴ ㅈㅏ ㄹㅗ S ㄱㅜ ㅂㅗ ㄷㅏ S ㄷㅏ
/home/beomgon/DeepSpeech/data/Zeroth/clips/201_003_2414.wav,ㅅㅏ S ㄷㅐ ㄱㅡ ㄹㅜㅂ ㅇㅢ S ㅂㅜ ㅊㅐ ㅂㅣ ㅇㅠㄹ ㅇㅡㄴ S ㅊㅣㄹ ㅅㅣㅂ S ㅇㅗ S ㅉㅓㅁ S ㄱㅗㅇ S ㅍㅓ ㅅㅔㄴ ㅌㅡ ㅇㅔ ㅅㅓ S ㅇㅗ ㅅㅣㅂ S ㄱㅜ S ㅉㅓㅁ S ㅅㅏ S ㅍㅓ ㅅㅔㄴ ㅌㅡ ㄹㅗ S ㅈㅜㄹ ㅇㅓㅆ ㄷㅏ
/home/beomgon/DeepSpeech/data/Zeroth/clips/201_003_2414.wav,ㅇㅣ ㅎㅐ S ㅇㅠ ㄹㅓㅂ ㅇㅢ S ㅂㅜ ㅊㅐ ㅂㅣ ㅇㅠㄹ ㅇㅡㄴ S ㅊㅣㄹ ㅅㅣㅂ S ㅇㅗ S ㅉㅓㅁ S ㄱㅗㅇ S ㅍㅓ ㅅㅔㄴ ㅌㅡ ㅇㅔ ㅅㅓ S ㅇㅗ ㅅㅣㅂ S ㄱㅜ S ㅉㅓㅁ S ㅅㅏ S ㅍㅓ ㅅㅔㄴ ㅌㅡ ㄹㅗ S ㅈㅜㄹ ㅇㅓㅆ ㄷㅏ
/home/beomgon/DeepSpeech/data/Zeroth/clips/140_003_0902.wav,ㅎㅔ ㄹㅓㄹ ㄷㅡ ㄱㅕㅇ ㅈㅔ S ㅂㅜㄱ ㅎㅏㄴ ㅇㅡㄴ S ㅂㅏㄹ ㅅㅏ S ㄱㅣ ㄱㅏㄴ ㅇㅡㄹ S ㅅㅜ ㅈㅓㅇ S ㅌㅗㅇ ㅂㅗ ㅎㅏㄴ ㄷㅐ ㄹㅗ S ㅊㅣㄹ S ㅇㅣㄹ S ㅇㅗ ㅈㅓㄴ S ㅁㅣ ㅅㅏ ㅇㅣㄹ ㅇㅡㄹ S ㅈㅓㄴ ㄱㅕㄱ S ㅂㅏㄹ ㅅㅏ ㅎㅐㅆ ㄷㅏ
/home/beomgon/DeepSpeech/data/Zeroth/clips/140_003_0902.wav,ㅅㅏ ㅇㅜ ㄷㅣ S ㄱㅕㅇ ㅈㅔ S ㅂㅜㄱ ㅎㅏㄴ ㅇㅡㄴ S ㅂㅏㄹ ㅅㅏ S ㄱㅣ ㄱㅏㄴ ㅇㅡㄹ S ㅅㅜ ㅈㅓㅇ S ㅌㅗㅇ ㅂㅗ ㅎㅏㄴ ㄷㅐ ㄹㅗ S ㅊㅣㄹ S ㅇㅣㄹ S ㅇㅗ ㅈㅓㄴ S ㅁㅣ ㅅㅏ ㅇㅣㄹ S ㅈㅓㄴ ㄱㅕㄱ S ㅂㅏㄹ ㅅㅏ ㅎㅐㅆ ㄷㅏ
/home/beomgon/DeepSpeech/data/Zeroth/clips/191_003_1813.wav,ㅋㅗ ㅅㅡ ㅍㅣ S ㄸㅓㄹ ㅇㅓ ㅈㅣㄹ S ㅁㅏㄴ ㅋㅡㅁ S ㄸㅓㄹ ㅇㅓ ㅈㅕㅆ ㄷㅏ ㅈㅡㅇ ㅅㅣ S ㅈㅓㄴ ㅁㅜㄴ ㄱㅏ ㄷㅡㄹ ㅇㅡㄴ S ㅊㅓㄴ S ㄱㅜ ㅂㅐㄱ S ㅇㅗ ㅅㅣㅂ S ㅇㅔ ㅅㅓ S ㅇㅣ ㅊㅓㄴ S ㅅㅓㄴ S ㅅㅏ ㅇㅣ ㄱㅏ S ㅋㅗ ㅅㅡ ㅍㅣ ㅇㅢ S ㄷㅏㄴ ㄱㅣ S ㅈㅓ ㅈㅓㅁ ㅇㅣ ㄹㅏ ㅁㅕ S ㅊㅜ ㄱㅏ ㄹㅗ S ㄱㅡㅂ ㄹㅏㄱ ㅎㅏㄹ S ㄱㅏ ㄴㅡㅇ ㅅㅓㅇ ㅇㅡㄴ S ㅋㅡ ㅈㅣ S ㅇㅏㄶ ㄷㅏ ㄱㅗ S ㅂㅜㄴ ㅅㅓㄱ ㅎㅐㅆ ㄷㅏ
/home/beomgon/DeepSpeech/data/Zeroth/clips/191_003_1813.wav,ㅅㅡ ㅍㅣ S ㄸㅓㄹ ㅇㅓ ㅈㅣㄹ S ㅁㅏㄴ ㅋㅡㅁ S ㄸㅓㄹ ㅇㅓ ㅈㅕㅆ ㄷㅏ S ㅈㅣ ㅅㅣ ㅈㅓㅇ ㄱㅘㄴ ㄷㅡㄹ ㅇㅡㄴ S ㅊㅓㄴ S ㄱㅜ ㅂㅐㄱ S ㅇㅗ ㅅㅣㅂ S ㅇㅔ ㅅㅓ S ㅇㅣ ㅊㅓㄴ S ㅅㅓㄴ S ㅅㅏ ㅇㅣ ㄱㅏ S ㅋㅗ ㅅㅡ ㅍㅣ ㅇㅢ S ㄷㅏㄴ ㄱㅣ S ㅈㅓ ㅈㅓㅁ ㅇㅣ ㄹㅏ ㅁㅕ S ㅊㅜ ㄱㅏ S ㄱㅜㄴ ㄹㅏㄱ ㅎㅏㄹ S ㄱㅏ ㄴㅡㅇ ㅅㅓㅇ ㅇㅡㄴ S ㅋㅡ ㅈㅣ S ㅇㅏㄶ ㄷㅏ ㄱㅗ S ㅂㅜㄴ ㅅㅓㄱ ㅎㅐㅆ ㄷㅏ
/home/beomgon/DeepSpeech/data/Zeroth/clips/206_003_0818.wav,ㅎㅏㄴ ㅍㅕㄴ S ㅇㅣㄴ ㄱㅡㄴ S ㅇㅡㅁ ㅅㅣㄱ ㅈㅓㅁ ㅇㅔ ㄷㅗ S ㄴㅐㅇ ㅁㅕㄴ ㄱㅘ S ㅁㅏㄱ ㄱㅜㄱ ㅅㅜ ㄹㅡㄹ S ㅎㅏ ㄴㅡㄴ S ㅇㅡㅁ ㅅㅣㄱ ㅈㅓㅁ ㅇㅣ S ㅅㅗㄴ ㄴㅣㅁ ㄷㅡㄹ ㄹㅗ S ㅂㅜㅁ ㅂㅕㅆ ㄷㅏ
/home/beomgon/DeepSpeech/data/Zeroth/clips/206_003_0818.wav,ㅎㅏㄴ ㅍㅕㄴ S ㅇㅣㄴ ㄱㅡㄴ S ㅇㅡㅁ ㅅㅣㄱ ㅈㅓㅁ ㅇㅔ ㄷㅗ S ㄴㅐㅇ ㅁㅕㄴ ㄱㅘ S ㅁㅏㄱ ㄱㅜㄱ ㅅㅜ ㄹㅏ ㄴㅡㄴ S ㅁㅣ ㅅㅣㄱ ㅈㅓㅁ ㅇㅣ S ㅅㅗㄴ ㄴㅣㅁ ㄷㅡㄹ ㄹㅗ S ㅂㅜㅁ ㅂㅕㅆ ㄷㅏ
/home/beomgon/DeepSpeech/data/Zeroth/clips/204_003_1565.wav,ㄴㅜㄴ ㅇㅔ S ㄸㅢ ㄴㅡㄴ S ㄷㅐ ㅁㅗㄱ ㅇㅡㄴ S ㄴㅏ ㅇㅣ ㄱㅏ S ㅇㅓ ㄹㅣㄹ ㅅㅜ ㄹㅗㄱ S ㅅㅣㄴ ㅎㅗㄴ ㅈㅣㅂ ㅇㅔ S ㅆㅡ ㄴㅡㄴ S ㄷㅗㄴ ㅇㅣ S ㅁㅏㄶ ㅇㅏㅆ ㄷㅏ ㄴㅡㄴ S ㅈㅓㅁ ㅇㅣ ㄷㅏ
/home/beomgon/DeepSpeech/data/Zeroth/clips/204_003_1565.wav,ㅇㅣ ㅎㅐ S ㅍㅣㄹ ㅎㅏㄴ S ㄷㅐ ㅁㅗㄱ ㅇㅡㄴ S ㄴㅏ ㅇㅣ ㄱㅏ S ㅇㅓ ㄹㅣㄹ ㅅㅜ ㄹㅗㄱ S ㅅㅣㄴ ㅎㅗㄴ ㅈㅣㅂ ㅇㅔ S ㅆㅡ ㄴㅡㄴ S ㄷㅗㄴ ㅇㅣ S ㅁㅏㄶ ㅇㅏㅆ ㄷㅏ ㄴㅡㄴ S ㅈㅓㅁ ㅇㅣ ㄷㅏ
/home/beomgon/DeepSpeech/data/Zeroth/clips/117_003_0797.wav,ㅈㅓㄴ ㄴㅏㄹ S ㅂㅏㅁ S ㅇㅠ ㅅㅡㅇ ㅁㅣㄴ S ㅇㅢ ㅇㅝㄴ S ㄷㅡㅇ ㅇㅣ S ㅌㅏㄹ ㄷㅏㅇ ㅎㅏ ㅁㅕㄴ ㅅㅓ S ㅇㅣ S ㅁㅜㄴ ㅈㅔ ㄱㅏ S ㄱㅓ ㅇㅢ S ㅇㅣㄹ ㄷㅏㄴ ㄹㅏㄱ ㄷㅚㄴ S ㄱㅓㅅ ㅇㅡ ㄹㅗ S ㅂㅘㅆ ㄷㅓㄴ S ㅊㅓㅇ ㅇㅘ ㄷㅐ ㄹㅗ ㅅㅓㄴ S ㅎㅓ ㄹㅡㄹ S ㅉㅣㄹ ㄹㅣㄴ S ㅅㅔㅁ ㅇㅣ ㄷㅏ
/home/beomgon/DeepSpeech/data/Zeroth/clips/117_003_0797.wav,ㅇㅣ ㄴㅏ ㄱㅏ S ㅁㅜ ㅅㅡㅇ ㅁㅣㄴ S ㅇㅢ ㅇㅝㄴ S ㄷㅡㅇ ㅇㅣ S ㄷㅐ ㄷㅏㅇ ㅎㅏ ㅁㅕㄴ ㅅㅓ S ㅇㅣ S ㅁㅜㄴ ㅈㅔ ㄱㅏ S ㄱㅓ ㅇㅢ S ㅇㅣㄹ ㄷㅏㄴ ㄹㅏㄱ ㄷㅚㄴ S ㄱㅓㅅ ㅇㅡ ㄹㅗ S ㅂㅘㅆ ㄷㅓㄴ S ㅊㅓㅇ ㅇㅘ ㄷㅐ ㄹㅗ ㅅㅓㄴ S ㅎㅓ ㄹㅡㄹ S ㅉㅣㄹ ㄹㅣㄴ S ㅅㅔㅁ ㅇㅣ ㄷㅏ
/home/beomgon/DeepSpeech/data/Zeroth/clips/212_003_2578.wav,ㅅㅗ ㅅㅕㄹ ㄴㅔ ㅌㅡ ㅇㅝ ㅋㅡ ㅅㅓ ㅂㅣ ㅅㅡ S ㅎㅘㄹ ㄷㅗㅇ ㄴㅐ ㅇㅕㄱ ㅇㅡㄹ S ㅈㅓㅁ ㄱㅓㅁ ㅎㅏㄴ S ㄱㅕㄹ ㄱㅘ S ㄱㅡ ㄱㅏ S ㅍㅏㄹ S ㅍㅓ ㅅㅔㄴ ㅌㅡ ㅇㅔ S ㅈㅔ ㅊㅜㄹ ㅎㅏㄴ S ㄱㅐ ㅇㅣㄴ ㅈㅓㅇ ㅂㅗ ㄱㅏ S ㅁㅏㅈ ㄷㅏ ㄴㅡㄴ S ㅈㅓㅁ ㅇㅡㄹ S ㅎㅘㄱ ㅇㅣㄴ ㅎㅏㄴ S ㄱㅓㅅ ㄷㅗ S ㅅㅣㄴ ㄹㅚ ㄷㅗ S ㅊㅡㄱ ㅁㅕㄴ ㅇㅔ ㅅㅓ S ㄱㅏ ㅅㅏㄴ ㅈㅓㅁ S ㅇㅛ ㅇㅣㄴ ㅇㅣ S ㄷㅙㅆ ㄷㅏ
/home/beomgon/DeepSpeech/data/Zeroth/clips/212_003_2578.wav,ㅇㅣ ㅅㅔ ㄴㅔ ㅌㅡ ㅇㅝ ㅋㅡ ㅅㅓ ㅂㅣ ㅅㅡ ㅇㅔ S ㄷㅗㅇ ㅎㅐ ㅇㅡㄹ S ㅈㅓㅇ ㅂㅜ ㅎㅏㄴ S ㄱㅕㄹ ㄱㅘ S ㄱㅡ ㄱㅏ S ㅍㅏㄹ S ㅍㅓ ㅅㅔㄴ ㅌㅡ ㅇㅔ S ㅈㅔ ㅊㅜㄹ ㅎㅏㄴ S ㄱㅐ ㅇㅣㄴ ㅈㅓㅇ ㅂㅗ ㄱㅏ S ㅁㅏㅈ ㄷㅏ ㄴㅡㄴ S ㅈㅓㅁ ㅇㅡㄹ S ㅎㅘㄱ ㅇㅣㄴ ㅎㅏㄴ S ㄱㅓㅅ ㄷㅗ S ㅅㅣㄴ ㄹㅚ ㄷㅗ S ㅊㅡㄱ ㅁㅕㄴ ㅇㅔ ㅅㅓ S ㄱㅏ ㅅㅏㄴ ㅈㅓㅁ S ㅇㅛ ㅇㅣㄴ ㅇㅣ S ㄷㅙㅆ ㄷㅏ
/home/beomgon/DeepSpeech/data/Zeroth/clips/151_003_0210.wav,ㄱㅜㄱ ㄴㅐ S ㄷㅐ ㅎㅏㄱ ㅇㅔ ㅅㅓ S ㄱㅛ ㅅㅜ ㄹㅗ S ㅎㅏㄱ ㅅㅐㅇ ㄷㅡㄹ ㅇㅡㄹ S ㄱㅏ ㄹㅡ ㅊㅕㅆ ㄱㅗ S ㅊㅐㄱ ㄷㅗ S ㄴㅐㅆ ㅅㅡㅂ ㄴㅣ ㄷㅏ
/home/beomgon/DeepSpeech/data/Zeroth/clips/151_003_0210.wav,ㄱㅜㄱ ㄴㅐ S ㄷㅐ ㅎㅏㄱ ㅇㅔ ㅅㅓ S ㄱㅛ ㅅㅜ ㄹㅗ S ㅎㅏㄱ ㅅㅐㅇ ㄷㅡㄹ ㅇㅡㄹ S ㄱㅏ ㄹㅡ ㅊㅕㅆ ㄱㅗ S ㅊㅐㄱ ㄷㅗ S ㄷㅐ ㅇㅡㅇ ㅇㅣ ㄴㅣ ㄷㅏ
/home/beomgon/DeepSpeech/data/Zeroth/clips/190_003_2114.wav,ㅈㅓㅇ ㅂㅗ ㄷㅏㅇ ㄱㅜㄱ ㅇㅡㄴ S ㅂㅜㄱ ㅎㅏㄴ ㅇㅣ S ㅈㅗ ㅇㅓㅂ ㄱㅝㄴ S ㅍㅏㄴ ㅁㅐ ㄹㅗ S ㅊㅣㄹ ㅊㅓㄴ S ㅇㅗ ㅂㅐㄱ S ㅁㅏㄴ S ㄷㅏㄹ ㄹㅓ ㄹㅡㄹ S ㅂㅓㄹ ㅇㅓ ㄷㅡㄹ ㅇㅕ S ㄱㅣㅁ S ㅇㅟ ㅇㅝㄴ ㅈㅏㅇ ㅇㅢ S ㅌㅗㅇ ㅊㅣ ㅈㅏ ㄱㅡㅁ ㅇㅡ ㄹㅗ S ㅅㅏ ㅇㅛㅇ ㅎㅏ ㄱㅗ S ㅇㅣㅆ ㄴㅡㄴ S ㄱㅓㅅ ㅇㅡ ㄹㅗ S ㅍㅏ ㅇㅏㄱ ㅎㅏ ㄱㅗ S ㅇㅣㅆ ㄷㅏ
/home/beomgon/DeepSpeech/data/Zeroth/clips/190_003_2114.wav,ㅈㅓㅇ ㅂㅗ ㄷㅏㅇ ㄱㅜㄱ ㅇㅡㄴ S ㅂㅜㄱ ㅎㅏㄴ ㅇㅣ S ㅈㅗ ㅇㅓㅂ ㄱㅝㄴ S ㅍㅏㄴ ㅁㅐ ㄹㅗ S ㅊㅣㄹ ㅊㅓㄴ S ㅇㅗ ㅂㅐㄱ S ㅁㅏㄴ S ㄷㅏㄹ ㄹㅓ ㄹㅡㄹ S ㅂㅓㄹ ㅇㅓ ㄷㅡㄹ ㅇㅣㄴ S ㄱㅣㄴ S ㅁㅓㄴ ㅈㅓ S ㅂㅏㅇ ㅊㅣ ㅈㅏ ㄱㅡㅁ ㅇㅡ ㄹㅗ S ㅅㅏ ㅇㅛㅇ ㅎㅏ ㄱㅗ S ㅇㅣㅆ ㄴㅡㄴ S ㄱㅓㅅ ㅇㅡ ㄹㅗ S ㅍㅏ ㅇㅏㄱ ㅎㅏ ㄱㅗ S ㅇㅣㅆ ㄷㅏ
/home/beomgon/DeepSpeech/data/Zeroth/clips/196_003_2441.wav,ㅅㅣㅂ S ㅇㅣ S ㅇㅣㄹ S ㅇㅗ ㅈㅓㄴ S ㅇㅕ ㄷㅓㄼ S ㅅㅣ ㄲㅔ S ㄷㅐ ㄱㅜ S ㅈㅜㅇ ㄱㅜ S ㄷㅗㅇ ㅅㅏㄴ ㅇㅢ ㄹㅛ ㅇㅝㄴ ㅇㅔ ㅅㅓ S ㅊㅣ ㄹㅛ ㅂㅏㄷ ㄷㅓㄴ S ㅈㅓㄹ ㄷㅗ S ㅍㅣ ㅇㅢ ㅈㅏ S ㅎㅕㄴ ㅁㅗ ㅆㅣ ㄱㅏ S ㅇㅣ S ㅊㅡㅇ S ㅇㅕ ㅈㅏ S ㅎㅘ ㅈㅏㅇ ㅅㅣㄹ S ㅊㅏㅇ ㅁㅜㄴ ㅇㅡㄹ S ㅌㅗㅇ ㅎㅐ S ㄷㅏㄹ ㅇㅏ ㄴㅏㅆ ㄷㅏ
/home/beomgon/DeepSpeech/data/Zeroth/clips/196_003_2441.wav,ㅅㅣㅂ S ㅇㅣ S ㅇㅣㄹ S ㅇㅗ ㅈㅓㄴ S ㅇㅕ ㄷㅓㄼ S ㅅㅣ ㄲㅔ S ㄷㅐ ㄱㅜ S ㅈㅜㅇ ㄱㅜ S ㄷㅗㅇ ㅅㅏㄴ ㅇㅢ S ㅇㅛㅇ ㅇㅔ ㅅㅓ S ㅊㅣ ㄹㅛ ㅂㅏㄷ ㄷㅓㄴ S ㅈㅓㄹ ㄷㅗ S ㅍㅣ ㅇㅢ ㅈㅏ S ㅎㅕㄴ ㅁㅗ ㅆㅣ ㄱㅏ S ㅇㅣ S ㅊㅡㅇ S ㅇㅕ ㅈㅏ S ㄷㅏㅇ ㅅㅣ S ㅈㅏㅇ ㄱㅘㄴ ㅇㅡㄹ S ㅌㅗㅇ ㅎㅐ S ㄷㅏㄹ ㅇㅏ ㄴㅏㅆ ㄷㅏ
/home/beomgon/DeepSpeech/data/Zeroth/clips/171_003_1955.wav,ㅁㅗㄹ ㄷㅣ ㅂㅡ S ㅂㅏㅇ ㅅㅗㅇ ㅇㅟ ㅇㅝㄴ ㅎㅚ ㄴㅡㄴ S ㄱㅜㄱ ㄱㅏ ㅇㅏㄴ ㅂㅗ ㅇㅔ S ㅇㅟ ㅎㅐ ㄹㅡㄹ S ㅈㅜㄹ S ㅅㅜ S ㅇㅣㅆ ㄴㅡㄴ S ㅇㅓ ㄸㅓㄴ S ㄴㅐ ㅇㅛㅇ ㄷㅗ S ㅂㅏㅇ ㅅㅗㅇ ㅎㅏ ㅈㅣ S ㅁㅏㄹ S ㄱㅓㅅ ㄷㅗ S ㅈㅣ ㅅㅣ ㅎㅐㅆ ㄷㅏ
/home/beomgon/DeepSpeech/data/Zeroth/clips/171_003_1955.wav,ㅇㅓ ㄷㅣ ㅂㅜ S ㄱㅏㅁ ㅅㅗ ㅇㅝㄴ ㅎㅚ ㄴㅡㄴ S ㄱㅜㄱ ㄱㅏ ㅇㅏㄴ ㅂㅗ ㅇㅔ S ㅇㅟ ㅎㅐ ㄹㅡㄹ S ㅈㅜㄹ S ㅅㅜ S ㅇㅣㅆ ㄴㅡㄴ S ㅇㅓ ㄸㅓㄴ S ㄴㅐ ㅇㅛㅇ ㄷㅗ S ㅂㅏㅇ ㅅㅗㅇ ㅎㅏ ㅈㅣ S ㅁㅏㄹ S ㄱㅓㅅ ㄷㅗ S ㅈㅣ ㅅㅣ ㅎㅐㅆ ㄷㅏ
/home/beomgon/DeepSpeech/data/Zeroth/clips/203_003_0679.wav,ㅁㅣ S ㄴㅠ ㅇㅛㄱ ㅌㅏ ㅇㅣㅁ ㅅㅡ ㅇㅔ S ㄸㅏ ㄹㅡ ㅁㅕㄴ S ㅎㅏ ㄹㅑ ㄴㅑ ㄴㅡㄴ S ㅇㅣㄴ ㄷㅗ ㅇㅔ ㅅㅓ S ㄴㅏㅁ ㄴㅕ S ㅅㅓㅇ ㅂㅣ S ㄱㅕㄱ ㅊㅏ ㄱㅏ S ㄱㅏ ㅈㅏㅇ S ㅅㅣㅁ ㅎㅏㄴ S ㄱㅗㅅ ㅇㅡ ㄹㅗ S ㅇㅠㄱ S ㅅㅔ S ㅇㅣ ㅅㅏㅇ S ㄴㅏㅁ ㄴㅕ S ㅅㅓㅇ ㅂㅣ ㄱㅏ S ㄴㅏㅁ ㅅㅓㅇ S ㅊㅓㄴ S ㅁㅕㅇ ㄷㅏㅇ S ㅍㅏㄹ ㅂㅐㄱ S ㅅㅡ ㅁㅜㄹ S ㄴㅔ S ㅁㅕㅇ ㅇㅔ S ㅇㅣ ㄹㅡㄴ ㄷㅏ
/home/beomgon/DeepSpeech/data/Zeroth/clips/203_003_0679.wav,ㅇㅣ S ㅁㅣ ㄱㅜㄱ S ㅌㅏ ㅇㅣㅁ ㅅㅡ ㅇㅔ S ㄸㅏ ㄹㅡ ㅁㅕㄴ S ㅎㅏ ㅇㅑ ㅎㅏ ㄴㅡㄴ S ㅇㅣㄴ ㄷㅗ ㅇㅔ ㅅㅓ S ㄴㅏㅁ ㄴㅕ S ㅅㅓㅇ ㅂㅣ S ㄱㅕㄱ ㅊㅏ ㄱㅏ S ㄱㅏ ㅈㅏㅇ S ㅅㅣㅁ ㅎㅏㄴ S ㄱㅗㅅ ㅇㅡ ㄹㅗ S ㅇㅠㄱ S ㅅㅔ S ㅇㅣ ㅅㅏㅇ S ㅇㅝㄴ ㄴㅕ S ㅅㅓㅇ ㅂㅣ ㄱㅏ S ㄴㅏㅁ ㅅㅓㅇ S ㅊㅓㄴ S ㅁㅕㅇ ㄷㅏㅇ S ㅍㅏㄹ ㅂㅐㄱ S ㅅㅡ ㅇㅡㄹ S ㄴㅔ S ㅁㅕㅇ ㅇㅔ S ㅇㅣ ㄹㅡㄴ ㄷㅏ
/home/beomgon/DeepSpeech/data/Zeroth/clips/115_003_2615.wav,ㄴㅐㅇ ㅈㅓㅇ ㅎㅣ S ㅁㅏㄹ ㅎㅐ S ㅅㅐ ㅈㅓㅇ ㅊㅣ ㅁㅣㄴ ㅈㅜ ㅇㅕㄴ ㅎㅏㅂ ㅇㅣ S ㅊㅗㅇ ㅅㅓㄴ ㅇㅔ ㅅㅓ S ㅅㅐ ㄴㅜ ㄹㅣ ㄷㅏㅇ ㄱㅘ S ㅆㅏ ㅇㅝ ㅂㅗ ㄹㅕ ㅁㅕㄴ S ㅁㅜㄴ ㅈㅐ ㅇㅣㄴ S ㅈㅣ ㅈㅣ ㅊㅡㅇ S ㅇㅏㄴ ㅊㅓㄹ ㅅㅜ S ㅈㅣ ㅈㅣ ㅊㅡㅇ S ㄱㅡ ㄹㅣ ㄱㅗ S ㅎㅗ ㄴㅏㅁ S ㅇㅠ ㄱㅝㄴ ㅈㅏ S ㅈㅜㅇ S ㅎㅏ ㄴㅏ ㄹㅏ ㄷㅗ S ㄸㅓㄹ ㅇㅓ ㅈㅕ S ㄴㅏ ㄱㅏ ㅁㅕㄴ S ㅇㅏㄴ S ㄷㅚㄴ ㄷㅏ
/home/beomgon/DeepSpeech/data/Zeroth/clips/115_003_2615.wav,ㅇㅣ ㅈㅓㅇ ㅇㅣㄴ S ㅁㅏ ㅇㅡㄹ S ㄷㅐ ㅂㅏㅇ ㅊㅣ ㅁㅣㄴ ㅈㅜ ㅇㅕㄴ ㅎㅏㅂ ㅇㅣ S ㅊㅗㅇ ㅅㅓㄴ ㅇㅔ ㅅㅓ S ㅅㅐ ㄴㅜ ㄹㅣ ㄷㅏㅇ ㄱㅘ S ㅆㅏ ㅇㅝ ㅂㅗ ㄹㅕ ㅁㅕㄴ S ㅁㅜㄴ ㅈㅐ ㅇㅣㄴ S ㅈㅣ ㅈㅣ ㅊㅡㅇ S ㅇㅏㄴ ㅊㅓㄹ ㅅㅜ S ㅈㅣ ㅈㅣ ㅊㅡㅇ S ㄱㅡ ㄹㅣ ㄱㅗ S ㅎㅗ ㄴㅏㅁ S ㅇㅠ ㄱㅝㄴ ㅈㅏ S ㅈㅜㅇ S ㅎㅏ ㄴㅏ ㄹㅏ ㄷㅗ S ㄸㅓㄹ ㅇㅓ ㅈㅕ S ㄴㅏ ㄱㅏ ㅁㅕㄴ S ㄷㅚㄴ ㄷㅏ
/home/beomgon/DeepSpeech/data/Zeroth/clips/186_003_2274.wav,ㅈㅐ ㅇㅣㅁ ㅇㅛㅇ S ㄱㅓ ㅂㅜ S ㅅㅗ ㅊㅓㅇ S ㅅㅣㅁ ㅅㅏ ㅇㅟ S ㄱㅕㄹ ㅈㅓㅇ S ㅅㅗ ㅅㅗㅇ S ㄷㅡㅇ S ㄱㅘ ㅈㅓㅇ ㅇㅡㄴ S ㅂㅏㄴ ㅂㅗㄱ ㄷㅙㅆ ㄷㅏ
/home/beomgon/DeepSpeech/data/Zeroth/clips/186_003_2274.wav,ㅇㅣ ㅁㅕㅇ S ㄱㅓ ㅂㅜ S ㅅㅗ ㅊㅓㅇ S ㅅㅣㅁ ㅅㅏ ㅇㅟ S ㄱㅕㄹ ㅈㅓㅇ S ㅅㅗ ㅅㅗㅇ S ㄷㅡㅇ S ㄱㅘ ㅈㅓㅇ ㅇㅡㄴ S ㅂㅏㄴ ㅂㅗㄱ ㄷㅙㅆ ㄷㅏ
/home/beomgon/DeepSpeech/data/Zeroth/clips/211_003_1029.wav,ㅂㅏㄴ ㅁㅕㄴ S ㅇㅣ ㅊㅓㄴ S ㄱㅜ S ㄴㅕㄴ S ㅇㅕㄴ ㅇㅖ ㄱㅖ ㅇㅘ S ㅈㅐ ㄱㅖ S ㅇㅣㄴ ㅅㅏ ㄷㅡㄹ ㅇㅣ S ㅅㅓㅇ S ㅅㅏㅇ ㄴㅏㅂ ㄱㅘ S ㅅㅜㄹ ㅈㅓㅂ ㄷㅐ ㄹㅡㄹ S ㅂㅏㄷ ㅇㅏㅆ ㄷㅏ ㄴㅡㄴ S ㅇㅢ ㅎㅗㄱ ㅇㅡ ㄹㅗ S ㅅㅔ ㄱㅏㄴ ㅇㅡㄹ S ㄸㅓ ㄷㅡㄹ ㅆㅓㄱ ㅎㅏ ㄱㅔ S ㅎㅐㅆ ㄷㅓㄴ S ㅈㅏㅇ ㅈㅏ ㅇㅕㄴ S ㄹㅣ ㅅㅡ ㅌㅡ ㅇㅢ S ㄷㅏㅇ ㅅㅏ ㅈㅏ ㄷㅡㄹ ㅇㅡㄴ S ㅊㅓ ㅂㅓㄹ ㄷㅚ ㅈㅣ S ㅇㅏㄶ ㅇㅏㅆ ㄷㅏ
/home/beomgon/DeepSpeech/data/Zeroth/clips/211_003_1029.wav,ㅇㅣ S ㅇㅕ S ㅇㅣ ㅊㅓㄴ S ㄱㅜ S ㄴㅕㄴ S ㅇㅕㄴ ㅇㅖ ㄱㅖ ㅇㅘ S ㅈㅐ ㄱㅖ S ㅇㅣㄴ ㅅㅏ ㄷㅡㄹ ㅇㅣ S ㅅㅓㅇ S ㅅㅏㅇ ㄴㅏㅂ ㄱㅘ S ㅅㅜㄹ ㅈㅓㅂ ㄷㅐ ㄹㅡㄹ S ㅂㅏㄷ ㅇㅏㅆ ㄷㅏ ㄴㅡㄴ S ㅇㅢ ㅎㅗㄱ ㅇㅡ ㄹㅗ S ㅅㅔ ㄱㅏ ㅇㅔ ㅅㅓ S ㄷㅡㄹ ㅅㅓㅇ ㅎㅏ ㄱㅔ S ㅎㅐㅆ ㄷㅓㄴ S ㅈㅏㅇ ㅈㅏ ㅇㅕㄴ S ㄹㅣ ㅅㅡ ㅌㅡ ㅇㅢ S ㄷㅏㅇ ㅅㅏ ㅈㅏ ㄷㅡㄹ ㅇㅡㄴ S ㅊㅓ ㅂㅓㄹ ㄷㅚ ㅈㅣ S ㅇㅏㄶ ㅇㅏㅆ ㄷㅏ
/home/beomgon/DeepSpeech/data/Zeroth/clips/136_003_1071.wav,ㅎㅏㅇ ㄱㅗㅇ ㅂㅗ ㅇㅏㄴ ㅂㅓㅂ S ㅅㅏ ㅅㅣㅂ S ㅇㅣ S ㅈㅗ ㅇㅔ ㄴㅡㄴ S ㅇㅜㄴ ㅎㅏㅇ ㅈㅜㅇ ㅇㅣㄴ S ㅎㅏㅇ ㄱㅗㅇ ㄱㅣ ㅇㅢ S ㅎㅏㅇ ㄹㅗ ㄹㅡㄹ S ㅂㅕㄴ ㄱㅕㅇ ㅎㅏ ㅇㅕ S ㅈㅓㅇ ㅅㅏㅇ S ㅇㅜㄴ ㅎㅏㅇ ㅇㅡㄹ S ㅂㅏㅇ ㅎㅐ ㅎㅏㄴ S ㅅㅏ ㄹㅏㅁ ㅇㅡㄴ S ㅇㅣㄹ S ㄴㅕㄴ S ㅇㅣ ㅅㅏㅇ S ㅅㅣㅂ S ㄴㅕㄴ S ㅇㅣ ㅎㅏ ㅇㅢ S ㅈㅣㅇ ㅇㅕㄱ ㅇㅔ S ㅊㅓ ㅎㅏㄴ ㄷㅏ ㄱㅗ S ㄷㅚ ㅇㅓ S ㅇㅣㅆ ㅅㅡㅂ ㄴㅣ ㄷㅏ
/home/beomgon/DeepSpeech/data/Zeroth/clips/136_003_1071.wav,ㅎㅏㅇ ㄱㅗㅇ ㅂㅗ ㅇㅏㄴ ㅂㅓㅂ S ㅅㅏ ㅅㅣㅂ S ㅇㅣ S ㅈㅗ ㅇㅔ ㄴㅡㄴ S ㅇㅜㄴ ㅎㅏㅇ ㅈㅜㅇ ㅇㅣㄴ S ㅎㅏㅇ ㄱㅗㅇ ㄱㅣ ㅇㅑㅇ ㄱㅜ ㄹㅡㄹ S ㅂㅕㄴ ㄱㅕㅇ ㅎㅏ ㅇㅕ S ㅈㅓㅇ ㅅㅏㅇ S ㅇㅗ ㄷㅏㄴ ㅇㅡㄹ S ㅈㅏㅇ ㅇㅐ ㅎㅏㄴ S ㅅㅏ ㄹㅏㅁ ㅇㅡㄴ S ㅇㅣㄹ S ㄴㅕㄴ S ㅇㅣ ㅅㅏㅇ S ㅅㅣㅂ S ㄴㅕㄴ S ㅇㅣ ㅎㅏ ㅇㅢ S ㅈㅣㅇ ㅇㅕㄱ ㅇㅔ S ㅊㅓ ㅎㅏㄴ ㄷㅏ ㄱㅗ S ㄷㅚ ㅇㅓ S ㅇㅣㅆ ㅅㅡㅂ ㄴㅣ ㄷㅏ
/home/beomgon/DeepSpeech/data/Zeroth/clips/158_003_0218.wav,ㅇㅏㅍ ㅉㅗㄱ ㅇㅔ ㄴㅡㄴ S ㄷㅏㄴ ㅅㅏㅇ ㅇㅡㄹ S ㅂㅣ ㄹㅗㅅ ㅎㅐ S ㄷㅐ ㅎㅕㅇ S ㅌㅔㄹ ㄹㅔ ㅂㅣ ㅈㅓㄴ ㅇㅣ S ㄷㅓㅍ ㄱㅐ ㄹㅗ S ㄷㅓㅍ ㅇㅕ ㅇㅣㅆ ㅇㅓㅆ ㄷㅏ
/home/beomgon/DeepSpeech/data/Zeroth/clips/158_003_0218.wav,ㅇㅣ S ㅈㅗ ㅇㅔ ㄴㅡㄴ S ㄷㅏㄴ ㅅㅏㅇ ㅇㅡㄹ S ㅂㅣ ㄹㅗㅅ ㅎㅐ S ㄷㅐ ㅎㅕㅇ S ㅌㅔㄹ ㄹㅔ ㅂㅣ ㅈㅓㄴ ㅇㅣ S ㄷㅓㅍ ㄱㅐ ㄹㅗ S ㄷㅓㅍ ㅇㅕ ㅇㅣㅆ ㅇㅓㅆ ㄷㅏ
/home/beomgon/DeepSpeech/data/Zeroth/clips/172_003_2577.wav,ㄱㅏ ㄴㅏㄴ ㅎㅏㄴ S ㅈㅏ ㅇㅢ S ㅋㅗ ㅋㅏ ㅇㅣㄴ ㅇㅣ ㄹㅏ ㄴㅡㄴ S ㅂㅕㄹ ㅊㅣㅇ ㅇㅣ S ㅂㅜㅌ ㅇㅡㄴ S ㅇㅣ ㅇㅠ ㄷㅗ S ㅇㅣ S ㄸㅐ ㅁㅜㄴ ㅇㅣ ㄷㅏ
/home/beomgon/DeepSpeech/data/Zeroth/clips/172_003_2577.wav,ㄱㅏ ㄴㅏㄴ ㅎㅏㄴ S ㅈㅏ ㅇㅢ S ㄱㅗ ㅎㅏㄴ S ㅇㅣ ㄹㅏ ㄴㅡㄴ S ㅂㅕㄹ ㅊㅣㅇ ㅇㅣ S ㅂㅜㅌ ㅇㅡㄴ S ㅇㅣ ㅇㅠ ㄷㅗ S ㅇㅣ S ㄸㅐ ㅁㅜㄴ ㅇㅣ ㄷㅏ
/home/beomgon/DeepSpeech/data/Zeroth/clips/114_003_1770.wav,ㅎㅘㄴ ㄱㅡㅂ ㄱㅡㅁ ㅇㅡㄹ S ㅈㅣ ㄱㅡㅂ ㅎㅏ ㄹㅏ ㄴㅡㄴ S ㅇㅜㄹ ㅅㅏㄴ ㅅㅣ ㅇㅢ S ㅅㅣ ㅈㅓㅇ ㅁㅕㅇ ㄹㅕㅇ ㄷㅗ S ㅇㅣ ㅎㅐㅇ ㅎㅏ ㅈㅣ S ㅇㅏㄶ ㅇㅡㄴ S ㅇㅓㅂ ㅊㅔ ㄷㅐ ㅍㅛ ㄴㅡㄴ S ㅇㅣㄹ S ㅅㅣㅁ S ㅈㅐ ㅍㅏㄴ ㅇㅔ ㅅㅓ S ㅈㅣㅇ ㅇㅕㄱ S ㅅㅏㅁ S ㄴㅕㄴ S ㅇㅠ S ㅇㅝㄹ ㅇㅡㄹ S ㅅㅓㄴ ㄱㅗ ㅂㅏㄷ ㅇㅏㅆ ㄷㅏ
/home/beomgon/DeepSpeech/data/Zeroth/clips/114_003_1770.wav,ㅇㅣ S ㅈㅗ ㄱㅡㅁ ㅇㅡㄹ S ㅈㅣ ㄱㅡㅂ ㅎㅏ ㄹㅏ ㄴㅡㄴ S ㅇㅜㄹ ㅅㅏㄴ ㅅㅣ ㅇㅢ S ㅅㅣ ㅈㅓㅇ ㅁㅕㅇ ㄹㅕㅇ ㄷㅗ S ㅇㅣ ㅎㅐㅇ ㅎㅏ ㅈㅣ S ㅇㅏㄶ ㅇㅡㄴ S ㅇㅓㅂ ㅊㅔ ㄷㅐ ㅍㅛ ㄴㅡㄴ S ㅇㅣㄹ S ㅅㅣㅁ S ㅈㅐ ㅍㅏㄴ ㅇㅔ ㅅㅓ S ㅈㅣㅇ ㅇㅕㄱ S ㅅㅏㅁ S ㄴㅕㄴ S ㅇㅠ S ㅇㅝㄹ ㅇㅡㄹ S ㅅㅓㄴ ㄱㅗ ㄱㅏ S ㄴㅏㅆ ㄷㅏ
/home/beomgon/DeepSpeech/data/Zeroth/clips/189_003_0102.wav,ㄹㅓㄴ ㄷㅓㄴ S ㅇㅞ ㅅㅡ ㅌㅡ ㅁㅣㄴ ㅅㅡ ㅌㅓ S ㄷㅐ ㅎㅏㄱ ㅇㅡㄹ S ㄴㅏ ㅇㅗㄴ S ㅅㅓㅇ ㅅㅣㄹ ㅎㅏ ㄱㅗ S ㅇㅖ ㅇㅢ S ㅂㅏ ㄹㅡㄴ S ㅎㅏㄱ ㅅㅐㅇ ㅇㅣ ㅇㅓㅆ ㅇㅡ ㄴㅏ S ㅇㅣ ㅅㅡㄹ ㄹㅏㅁ ㄱㅛ ㄷㅗ ㅇㅔ S ㄷㅐ ㅎㅏㄴ S ㅇㅕㅇ ㄱㅜㄱ S ㄷㅏㅇ ㄱㅜㄱ ㅇㅢ S ㅂㅜ ㄷㅏㅇ ㅎㅏㄴ S ㄷㅐ ㅇㅜ ㅇㅔ S ㅂㅜㄴ ㄱㅐ ㅎㅐ S ㄱㅡㅂ ㅈㅣㄴ ㅈㅜ ㅇㅢ ㅈㅏ ㄹㅗ S ㅈㅓㄴ ㅎㅑㅇ ㅎㅏㄴ S ㄱㅓㅅ ㅇㅡ ㄹㅗ S ㅇㅏㄹ ㄹㅕ ㅈㅕㅆ ㄷㅏ
/home/beomgon/DeepSpeech/data/Zeroth/clips/189_003_0102.wav,ㅇㅏ ㅅㅓ S ㅇㅚ ㅌㅡ ㅁㅣㄴ ㅅㅡ ㅌㅓ ㅇㅔ S ㅇㅏ ㅇㅡㄹ S ㄴㅏ ㅇㅗㄴ S ㅅㅓㅇ ㅅㅣㄹ ㅎㅏ ㄱㅗ S ㅇㅖ ㄹㅣ S ㅂㅏ ㄹㅡㄴ S ㅎㅏㄱ ㅅㅐㅇ ㅇㅣ ㅇㅓㅆ ㅇㅡ ㄴㅏ S ㅇㅣ ㅅㅡㄹ ㄹㅏㅁ ㄱㅛ ㄷㅗ ㅇㅔ S ㄷㅐ ㅎㅏㄴ S ㅇㅕㅇ ㄱㅜㄱ S ㄷㅏㅇ ㄱㅜㄱ ㅇㅢ S ㅂㅜ ㄷㅏㅇ ㅎㅏㄴ S ㄷㅐ ㅇㅜ ㅇㅔ S ㅂㅜㄴ ㄱㅐ ㅎㅐ S ㄱㅡㅂ ㅈㅣㄴ ㅈㅜ ㅇㅢ ㅈㅏ ㄹㅗ S ㅈㅓㄴ ㅎㅑㅇ ㅎㅏㄴ S ㄱㅓㅅ ㅇㅡ ㄹㅗ S ㅇㅏㄹ ㄹㅕ ㅈㅕㅆ ㄷㅏ
/home/beomgon/DeepSpeech/data/Zeroth/clips/216_003_0751.wav,ㄴㅜㄴ S ㅈㅜ ㅂㅕㄴ ㅇㅔ ㄴㅡㄴ S ㅂㅜ ㅈㅗㅇ ㄱㅘ S ㄱㅓㅁ ㅂㅜㄺ ㅇㅡㄴ S ㅂㅏㄴ ㅈㅓㅁ ㅇㅣ S ㅍㅣ ㅇㅓ S ㅇㅣㅆ ㄱㅗ S ㅂㅗㄹ ㄱㅘ S ㅇㅣ ㅁㅏ ㄴㅡㄴ S ㄸㅏㄱ ㄸㅏㄱ ㅎㅏ ㄱㅔ S ㄱㅜㄷ ㅇㅓ S ㅁㅏ ㅊㅣ S ㄱㅏ ㅁㅕㄴ ㅇㅡㄹ S ㅆㅡㄴ S ㄷㅡㅅ ㅎㅐㅆ ㄷㅏ
/home/beomgon/DeepSpeech/data/Zeroth/clips/216_003_0751.wav,ㄴㅜㄴ S ㅈㅜ ㅂㅕㄴ ㅇㅔ ㄴㅡㄴ S ㅂㅜ ㅈㅗㅇ ㄱㅘ S ㄱㅓㅁ ㅂㅜㄺ ㅇㅡㄴ S ㅂㅏㄴ ㅈㅓㅁ ㅇㅣ S ㅍㅣ ㅇㅓ S ㅇㅣㅆ ㄱㅗ S ㅂㅗㄹ ㄱㅘ S ㅇㅣ ㅁㅏ ㅇㅣ ㅁㅕㄴ S ㄸㅏㄱ ㄸㅏㄱ ㅎㅏ ㄱㅔ S ㄷㅜ S ㄷㅓ S ㅁㅏ ㅊㅣ S ㄱㅏ ㅁㅕㄴ ㅇㅡㄹ S ㅆㅡㄴ S ㄷㅡㅅ ㅎㅐㅆ ㄷㅏ
/home/beomgon/DeepSpeech/data/Zeroth/clips/186_003_2357.wav,ㅅㅐ ㄹㅗ S ㅈㅜ ㅌㅐㄱ ㅇㅡㄹ S ㅈㅣㅅ ㄴㅡㄴ S ㅌㅐㄱ ㅈㅣ ㄱㅗㅇ ㄱㅡㅂ ㅇㅡㄹ S ㅊㅜㄱ ㅅㅗ ㅎㅏ ㄱㅗ S ㄷㅐ ㅊㅜㄹ S ㅅㅣㅁ ㅅㅏ ㄹㅡㄹ S ㄱㅏㅇ ㅎㅘ ㅎㅏ ㄱㅔㅆ ㄷㅏ ㄴㅡㄴ S ㄴㅐ ㅇㅛㅇ ㅇㅣ ㅇㅓㅆ ㅅㅡㅂ ㄴㅣ ㄷㅏ
/home/beomgon/DeepSpeech/data/Zeroth/clips/186_003_2357.wav,ㅇㅣ ㅎㅜ S ㅈㅜ ㅌㅐㄱ ㅇㅡㄹ S ㅈㅣㅅ ㄴㅡㄴ S ㅌㅐㄱ ㅈㅣ ㄱㅗㅇ ㄱㅡㅂ ㅇㅡㄹ S ㅊㅜㄱ ㅅㅗ ㅎㅏ ㄱㅗ S ㄷㅐ ㅊㅜㄹ S ㅅㅣㅁ ㅅㅏ ㄹㅡㄹ S ㄱㅏㅇ ㅎㅘ ㅎㅏ ㄱㅔㅆ ㄷㅏ ㄴㅡㄴ S ㄴㅐ ㅇㅛㅇ ㅇㅣ ㅇㅓㅆ ㄷㅏ
/home/beomgon/DeepSpeech/data/Zeroth/clips/154_003_0869.wav,ㅅㅣㅂ S ㄱㅜ S ㅅㅔ ㄱㅣ S ㅊㅗ ㅇㅔ S ㅇㅕㅇ ㄱㅜㄱ S ㅇㅣㅇ ㄱㅡㄹ ㄹㅐㄴ ㄷㅡ ㅇㅘ S ㅅㅡ ㅋㅗ ㅌㅡㄹ ㄹㅐㄴ ㄷㅡ S ㅇㅞ ㅇㅣㄹ ㅅㅡ ㅇㅔ S ㅇㅣㅆ ㄷㅓㄴ S ㅇㅜㄴ ㅎㅏ ㄷㅡㄹ ㅇㅢ S ㄱㅣㄹ ㅇㅣ ㄹㅡㄹ S ㅁㅗ ㄷㅜ S ㅎㅏㅂ ㅎㅏ ㅁㅕㄴ S ㅇㅠㄱ ㅊㅓㄴ S ㅋㅣㄹ ㄹㅗ ㅁㅣ ㅌㅓ ㅇㅔ S ㄷㅏㄹ ㅎㅐㅆ ㅅㅡㅂ ㄴㅣ ㄷㅏ
/home/beomgon/DeepSpeech/data/Zeroth/clips/154_003_0869.wav,ㅅㅣㅂ S ㄱㅜ S ㅅㅔ ㄱㅣ S ㅊㅗ ㅇㅔ S ㅇㅕㅇ ㄱㅜㄱ S ㅇㅣㅇ ㄱㅡㄹ ㄹㅐㄴ ㄷㅡ ㅇㅘ S ㅅㅡ ㅋㅗ ㅌㅡㄹ ㄹㅐㄴ ㄷㅡ S ㅇㅞ ㅇㅣㄹ ㅅㅡ ㄷㅓㄴ S ㅇㅜㄴ ㅎㅏ ㄷㅡㄹ ㅇㅢ S ㄱㅣ ㄹㅡㄹ S ㅁㅗ ㄷㅜ S ㅎㅏㅂ ㅎㅏ ㅁㅕㄴ S ㅇㅠㄱ ㅊㅓㄴ S ㅋㅣㄹ ㄹㅗ ㅁㅣ ㅌㅓ ㅇㅔ S ㄷㅏㄹ S ㅅㅡㅂ ㄴㅣ ㄷㅏ
/home/beomgon/DeepSpeech/data/Zeroth/clips/188_003_0609.wav,ㅎㅏㄹ ㅁㅓ ㄴㅣ ㅇㅢ S ㅇㅣ ㅇㅜㅅ ㄷㅡㄹ S ㅈㅜㅇ S ㅅㅏㅇ ㄷㅏㅇ ㅅㅜ ㄱㅏ S ㅋㅗ ㅋㅗ ㄴㅓㅅ S ㅁㅗㄱ ㅈㅐ ㄹㅗ S ㅇㅗ ㄷㅜ ㅁㅏㄱ ㅇㅡㄹ S ㅈㅣ ㅇㅓㅆ ㄱㅗ S ㅈㅣ ㅂㅜㅇ ㅇㅡㄴ S ㅁㅏㄹ ㄹㅣㄴ S ㅋㅗ ㅋㅗ ㄴㅓㅅ S ㅇㅣㅍ ㅇㅡ ㄹㅗ S ㅁㅏㄴ ㄷㅡㄹ ㅇㅓㅆ ㅈㅣ ㅇㅛ
/home/beomgon/DeepSpeech/data/Zeroth/clips/188_003_0609.wav,ㅎㅏㄹ ㅁㅓ ㄴㅣ ㅇㅢ S ㅇㅣ ㅇㅜㅅ ㄷㅡㄹ S ㅈㅜㅇ S ㅅㅏㅇ ㄷㅏㅇ ㅅㅜ ㄱㅏ S ㅋㅗ ㅋㅗ ㄴㅓㅅ S ㅁㅗㄱ ㅈㅐ ㄹㅗ S ㅇㅗ ㄷㅜ ㅁㅏㄱ ㅇㅡㄹ S ㅈㅣ ㅇㅓㅆ ㄱㅗ S ㅈㅣ ㄱㅜ ㅂㅜㄴ S ㅁㅏㄹ ㄹㅣㄴ S ㅋㅗ ㅋㅗ ㅅㅓ ㅂㅣ ㅇㅡ ㄹㅗ S ㅁㅏㄴ ㄷㅡㄹ ㅇㅓㅆ ㅈㅣ ㅇㅛ
/home/beomgon/DeepSpeech/data/Zeroth/clips/183_003_2617.wav,ㅂㅜㄱ ㅎㅏㄴ ㅇㅢ S ㅊㅗㅁ ㅊㅗㅁ ㅎㅏㄴ S ㅂㅏㅇ ㄱㅗㅇ ㅁㅏㅇ S ㄸㅐ ㅁㅜㄴ ㅇㅔ S ㅇㅠ ㅇㅣㄴ S ㅍㅗㄱ ㄱㅕㄱ ㄱㅣ ㅂㅗ ㄷㅏ ㄴㅡㄴ S ㅅㅜㄴ ㅎㅏㅇ ㅁㅣ ㅅㅏ ㅇㅣㄹ ㅇㅣ S ㅇㅏ ㄱㅜㄴ S ㅍㅣ ㅎㅐ ㄹㅡㄹ S ㅈㅜㄹ ㅇㅣㄹ S ㅅㅜ S ㅇㅣㅆ ㄱㅣ S ㄸㅐ ㅁㅜㄴ ㅇㅣㅂ ㄴㅣ ㄷㅏ
